screen_name,created_at,text,in_reply_to_screen_name,retweeted_status_screen_name,user_description,source,lang,id
LucianoHuck,2020-06-23T19:55:52Z,"Como ja disse, sou a favor da Renda Basica. Seria a evolução dos nossos programas de proteção social. Nada + justo. Esta rolando no movimento Renda Básica que Queremos uma campanha p/ prorrogar o auxílio emergencial até dez. Planejando de onde sairiam os recursos, seria ótimo. https://t.co/CE7gqfwRFT",,,curious / curioso,Twitter for iPhone,pt,1275517952599736322
LucianoHuck,2020-06-23T16:09:43Z,"Não estamos todos no mesmo barco. A pandemia iluminou como nunca nossas desigualdades. Sondagem do @IBOPE_In mostra q pandemia chegou em momentos ≠s em cada comunidade do Rio. Ainda não há condições de relaxar o isolamento, alerta Gilmar Azevedo da @ABRASCO. Concordo. https://t.co/4H0uLJlT8o",,,curious / curioso,Twitter for iPhone,pt,1275461039476408324
LucianoHuck,2020-06-23T16:06:35Z,"Nosso caminho + potente seria na direção de nos tornarmos referência e a maior potência verde do 🌎. O maior produtor mudial de alimentos, e simultaneamente, o maior protetor de florestas e biodiversidade. É possível. Preservação, produção e desenvolvimento; juntos e misturados. https://t.co/i5WGCe8N9K",,,curious / curioso,Twitter for iPhone,pt,1275460252457189376
LucianoHuck,2020-06-22T23:00:35Z,"Estava lendo q Campinas irá fechar novamente o comércio. Abriram ha 2 semanas e hj estão c/leitos municipais de UTI 100% ocupados. A pressão é grd, mas o cuidado tem d ser maior. Esta ansiedade vai deixando a solução definitiva cada vez + longe.",,,curious / curioso,Twitter for iPhone,pt,1275202049706209280
LucianoHuck,2020-06-21T21:00:47Z,"Aproveito a data p/ cumprimentar o senador @esuplicy pelos seus 79 anos. E feliz em ver suas ideias sobre a necessária “renda mínima” - q há décadas ele defende, ganhar corpo no debate público entre interlocutores capazes de apresentar soluções de viabilidade social e econômica.",,,curious / curioso,Twitter for iPhone,pt,1274809514630447114
LucianoHuck,2020-06-21T16:49:48Z,Pesquisa mostra q 7 milhões d mulheres abandonaram o mercado de trabalho qdo começou a quarentena. 2Mi a + do q o número d homens na msm situação. Mulheres têm + dificuldades d se manter no mercado. A pandemia tornou td ainda mais. + igualdade de oportunidades é + cidadania. https://t.co/Ls5S4copun,,,curious / curioso,Twitter for iPhone,pt,1274746353474842624
LucianoHuck,2020-06-21T16:43:02Z,É pre­ci­so tb cui­dar me­lhor do SUS. O SUS é um avan­ço civiliza­tó­rio q ti­rou a saú­de da lógica de mer­ca­do ou do me­ro as­sis­ten­ci­a­lis­mo e a al­çou à cate­go­ria de direito uni­ver­sal. A pan­de­mia evi­den­ci­ou sua impor­tân­cia. Conclui o @Estadao. E eu concordo.,LucianoHuck,,curious / curioso,Twitter for iPhone,pt,1274744649400438792
LucianoHuck,2020-06-21T16:43:02Z,"A pan­de­mia atin­giu todos, mas uns foram mui­to + afe­ta­dos do q outros. Pas­sa da ho­ra d a nação olhar p/ seus mi­lhões d desvalidos e lu­tar p/ redu­zir a bru­tal con­cen­tra­ção d ren­da q trava o desenvolvimen­to no país. Defende o @Estadao.",LucianoHuck,,curious / curioso,Twitter for iPhone,pt,1274744647366127616
LucianoHuck,2020-06-21T16:43:01Z,O tris­te mar­co aumen­tará a coesão da na­ção ca­so ti­re­mos as li­ções cor­re­tas des­sa tra­gé­dia e as transformemos em ação políti­ca concreta. A so­ci­e­da­de de­ve aumen­tar o grau d exigência na es­co­lha d seus governantes. Propõe o @Estadao.,LucianoHuck,,curious / curioso,Twitter for iPhone,pt,1274744645717831682
LucianoHuck,2020-06-21T16:43:01Z,"Segundo o @Estadao, nada apa­gará memória das brasileiras e dos brasileiros o fa­to de q, em apenas três me­ses de 2020, + de 50 mil cidadãs e cidadãos mor­re­ram em de­cor­rên­cia da Co­vid-19.",LucianoHuck,,curious / curioso,Twitter for iPhone,pt,1274744644153245702
LucianoHuck,2020-06-21T16:43:01Z,"P/ o @Estadão, a me­lhor for­ma d hon­rar a memó­ria dos mais d 50 mil mortos em de­cor­rên­cia da Covid-19 é tor­nar o BR 1 país me­nos desigual e + fra­ter­no. 1 lu­gar me­lhor p/ se vi­ver.",LucianoHuck,,curious / curioso,Twitter for iPhone,pt,1274744642437894146
LucianoHuck,2020-06-21T16:43:00Z,"Empre­sas quebra­das po­de­rão, eventualmen­te, ser re­er­gui­das. Ou­tras tan­tas se­rão cri­a­das pelas ne­ces­si­da­des im­pos­tas por 1 even­to des­sa mag­ni­tu­de. Em­pre­gos serão re­cu­pe­ra­dos. Au­las re­to­ma­das. O comér­cio já em fran­co proces­so de re­a­ber­tu­ra.",LucianoHuck,,curious / curioso,Twitter for iPhone,pt,1274744640898555904
LucianoHuck,2020-06-21T16:43:00Z,"Irretocável o editorial do @Estadao de hj. Compartilho algumas passagens; Por + se­ve­ras que se­jam, qua­se to­das as per­das econômicas oca­si­o­na­das pe­la pan­de­mia po­de­rão ser su­pe­ra­das + ce­do ou + tar­de, com mai­or ou me­nor grau de di­fi­cul­da­de. (segue o fio) https://t.co/yelp0wBUr6",,,curious / curioso,Twitter for iPhone,pt,1274744638755176448
LucianoHuck,2020-06-21T14:00:16Z,"Genial a campanha do governo neozelandês sobre os perigos da internet. O governo da Nova Zelândia esta dando várias lições ao mundo, começando pelo combate a Covid-19, que virou referência mundial. Salva de palmas a primeira ministra @jacindaardern 👏🏻 https://t.co/RzVkoirSiH",,,curious / curioso,Twitter for iPhone,pt,1274703686304960512
LucianoHuck,2020-06-21T00:49:52Z,"Passamos da triste marca de 50 mil mortes por Covid-19 no BR. Não é só 1 número. São vidas e histórias pessoais e familiares interrompidas. Mães, pais, avós, avôs, filhos e filhas — gente que partiu. Emocionante as falas de  @realwbonner e Renata Vasconcellos no @jornalnacional https://t.co/oIhmI26ShO",,,curious / curioso,Twitter for iPhone,pt,1274504776139575296
LucianoHuck,2020-06-20T13:46:02Z,👏🏻👏🏻👏🏻👏🏻👏🏻👏🏻👏🏻👏🏻 https://t.co/zZ0utgfSmp,LucianoHuck,,curious / curioso,Twitter for iPhone,,1274337718252843008
LucianoHuck,2020-06-20T13:45:59Z,https://t.co/4WZqSsOCKM,LucianoHuck,,curious / curioso,Twitter for iPhone,,1274337704386404353
LucianoHuck,2020-06-20T13:45:57Z,"A desigualdade digital também é cruel, ainda mais em um sociedade cada vez mais digitalizada. https://t.co/EJNfQos99x",LucianoHuck,,curious / curioso,Twitter for iPhone,pt,1274337694680788992
LucianoHuck,2020-06-20T13:45:54Z,https://t.co/BKZgFJi2vg,LucianoHuck,,curious / curioso,Twitter for iPhone,,1274337685201735681
LucianoHuck,2020-06-20T13:45:52Z,Ponto muito importante. A desigualdade de oportunidades é cruel. https://t.co/2wiMqGFDN4,LucianoHuck,,curious / curioso,Twitter for iPhone,pt,1274337675978452992
LucianoHuck,2020-06-20T13:45:49Z,https://t.co/hsZOOJvauw,LucianoHuck,,curious / curioso,Twitter for iPhone,,1274337664330862592
LucianoHuck,2020-06-20T13:45:44Z,https://t.co/KFKqaG95gy,LucianoHuck,,curious / curioso,Twitter for iPhone,,1274337642822479874
LucianoHuck,2020-06-20T13:45:41Z,"Leitura imprescindível. A nova pesquisa do @i_locomotiva &amp; @CUFA_Brasil. Números e ptos importantes. Somos um país de maioria negra, c/ cidadãos orgulhosos da sua cor. 🙏🏻 119 milhões de brasileiros a exigir + respeito e + oportunidades.  (segue o fio) https://t.co/uGz7JPVrqP",,,curious / curioso,Twitter for iPhone,pt,1274337630843478017
LucianoHuck,2020-06-20T12:19:47Z,"São quase 50 mil mortes. Fora as subnotificações. Todo meu carinho às famílias das vítimas. O inverno começa amanhã. O frio aumenta as chances de proliferação. A doença cresce no interior. Se cuide. Se puder, fique em casa. Na rua, use máscara.",LucianoHuck,,curious / curioso,Twitter for iPhone,pt,1274316009948745729
LucianoHuck,2020-06-20T12:19:46Z,"A pandemia não é como um feriado prolongado que termina no domingo. Não acabou. Muitos estados relaxaram o isolamento, mas o Brasil tem mais de 1 milhão de casos confirmados. Temos de seguir firmes. (segue abaixo)",,,curious / curioso,Twitter for iPhone,pt,1274316008531144705
LucianoHuck,2020-06-20T11:50:31Z,Impunidade criminal para desvios e excesso de sanções que ameaçam os bons gestores. Uma cruel combinação que está colocando vidas em risco. O pior do mundos; um sistema leve p/ o desonesto e pesado p/ o honesto. Vale a leitura de @DanielGoldber1 na @exame. https://t.co/LwxQT3C3h4,,,curious / curioso,Twitter for iPhone,pt,1274308646562906112
LucianoHuck,2020-06-20T04:03:05Z,"Que exemplo incrível! Depois de ser a mais jovem mulher a ser homenageada com um prêmio Nobel, @Malala chegou lá. Vítima da violência brutal dos Talibãs no Paquistão por querer ter o direito a estudar, agora ela se formou numa das principais universidades do mundo. 👏🏻👏🏻👏🏻👏🏻 https://t.co/3A8EXDWZdk",,,curious / curioso,Twitter for iPhone,pt,1274191012676677632
LucianoHuck,2020-06-19T19:00:33Z,"Entrando agora ao vivo agora as 16h com @luizatrajano, Paulo Caffarelli e Wilson Poit. Ai vai o link; https://t.co/tckPezKtOd",,,curious / curioso,Twitter for iPhone,pt,1274054481613815808
LucianoHuck,2020-06-18T20:24:25Z,Sinceramente espero q o país não troque 6 por meia dúzia no MEC. A mudança de direção tem q ser profunda em relação aos últimos 14 meses de uma gestão desastrosa na Educação. A nossa ferramenta + poderosa p/ gerar oportunidades e mobilidade social. Não pode ser rifada de novo.,,,curious / curioso,Twitter for iPhone,pt,1273713198903046156
LucianoHuck,2020-06-16T22:24:07Z,"A associação de moradores da favela Porto de Areia acolhe cidadãos em situação de risco em Carapicuíba na Grande São Paulo. É a solidariedade + contagiosa q o vírus. Na @folha. Se puder, faça algo por alguém também. https://t.co/5C7HeNpLTi",,,curious / curioso,Twitter for iPhone,pt,1273018543664177152
LucianoHuck,2020-06-16T22:22:29Z,A Natura dá exemplo de responsabilidade social ao anunciar que vai investir 800 milhões de dólares nos próximos 10 anos em sustentabilidade. Show. Exemplo arrasta. @valoreconomico https://t.co/kcl6jzyzkv,,,curious / curioso,Twitter for iPhone,pt,1273018134463725569
LucianoHuck,2020-06-15T20:27:12Z,"Fico feliz em saber. Tempos difíceis á frente, e enormes desafios para nossa economia. O endosso de @PauloHartungES é um bom começo. https://t.co/7OAJBSbKGO",,,curious / curioso,Twitter for iPhone,pt,1272626733204856832
LucianoHuck,2020-06-15T16:26:42Z,"Fernando Gabeira defenda a luta “amada”. Genial, como sempre. https://t.co/idor25R4zI",,,curious / curioso,Twitter for iPhone,pt,1272566211910516739
LucianoHuck,2020-06-15T16:25:06Z,"Os países q relaxaram o isolamento social decidiram só após 1 aumento nos testes e uma queda acentuada nos números de casos. Em um país continental como o BR, é importante analisar a situação de cada cidade e estado. decisões precipitadas, s/ ouvir a ciência, são mt arriscadas.",LucianoHuck,,curious / curioso,Twitter for iPhone,pt,1272565810100350982
LucianoHuck,2020-06-15T16:25:06Z,"É preciso consciência, mostra @tabataamaralsp. Preocupa o fim da quarentena s/ o cenário e os mecanismos p/ dar segurança à população. Precisamos de 1 plano transparente e dados confiáveis. Liderar é tb nadar contra as correntezas das simplificações desinformadas. https://t.co/pjiEczNbhy",,,curious / curioso,Twitter for iPhone,pt,1272565806711353344
LucianoHuck,2020-06-15T16:03:03Z,"Na mesma pauta; Os nossos jovens negros têm de estar dentro das universidades pra ficar bem longe da mira da bala, diz Márcia Lima, do @cebrap, na @folha. Pra professora da USP, a violência racial é indicadora de desigualdade. Fato. https://t.co/62RMl3Ctx5",,,curious / curioso,Twitter for iPhone,pt,1272560261141069830
LucianoHuck,2020-06-15T16:01:16Z,A professora defende que o racismo não é um problema exclusivo dos negros — faz parte de uma agenda republicana brasileira. E mais uma vez concordo com ela.,LucianoHuck,,curious / curioso,Twitter for iPhone,pt,1272559808454045697
LucianoHuck,2020-06-15T16:01:15Z,En­xer­gar é bi­o­ló­gi­co. Ver é op­ção cul­tu­ral. O BR é 1 país q insiste em não ver o seu racis­mo. Mas com discriminação não há democracia. Concordo c/ @LiliaSchwarcz no @Estadao. https://t.co/mYyUpQDYGT,,,curious / curioso,Twitter for iPhone,pt,1272559806067466241
LucianoHuck,2020-06-15T15:44:44Z,"Um projeto responsável de renda básica tem de fazer o melhor uso de recursos escassos. Pra isso, é preciso enfrentar o Estado corporativista q perpetua privilégios e a desigualdade social. No editorial da @folha. https://t.co/CbJBpkVRod",,,curious / curioso,Twitter for iPhone,pt,1272555648115453953
LucianoHuck,2020-06-14T23:59:21Z,A vida não é filme e eles não entenderam. Radicais agem guiados por fantasias violentas e não aceitam os limites da realidade democrática. Fogos de artifício servem pra celebrar. Não pra atacar instituições. O STF merece respeito.,,,curious / curioso,Twitter for iPhone,pt,1272317737428299780
LucianoHuck,2020-06-14T20:43:33Z,Para aqueles que julgam como se esta fosse a sua grande contribuição à democracia. https://t.co/32Mmu7UQOz,,,curious / curioso,Twitter Web App,pt,1272268460064677891
LucianoHuck,2020-06-14T16:48:56Z,"Meu irmão e minha mãe.
Muito orgulho da nossa família.
@GROSTEINANDRADE no Instagram. 
Vou assistir. Hoje as 14h.
Família é tudo de bom. https://t.co/l40l6saDsB",,,curious / curioso,Twitter for iPhone,pt,1272209418344685571
LucianoHuck,2020-06-14T13:51:32Z,"Também no @Estadao, @Celso_Ming vê a pandemia am­pli­fi­car o de­ba­te sobre a ren­da básica. Não é mais só uma questão so­ci­al, diz. O capi­ta­lis­mo 4.0 quer pro­pi­ciar um mer­ca­do mí­ni­mo de con­su­mo ca­paz de dar sus­ten­ta­ção às em­pre­sas. Bom ponto. https://t.co/c5ka3uLwmx",,,curious / curioso,Twitter for iPhone,pt,1272164775708053505
LucianoHuck,2020-06-14T13:50:35Z,"Mt bom artigo de Pedro Malan no @Estadao. Diz que a sociedade brasileira vem se expressando mais. E o que quer a maioria do Brasil. Respeito aos fatos. Coordenação. Diálogo franco. Visão plural. Numa palavra, democracia. https://t.co/1JZYayHaIs",,,curious / curioso,Twitter for iPhone,pt,1272164536192303105
LucianoHuck,2020-06-14T12:35:34Z,"Marcos Lisboa do @Insper manda bem na @folha de hoje. Muito pode ser feito p/ melhorar a eficácia da política social, reduzir a pobreza e desestimular a informalidade. O sucesso depende de propostas criativas e detalhadas q atentem p/ a complexidade dos problemas. É isso. https://t.co/OCCeyG3qgj",,,curious / curioso,Twitter for iPhone,pt,1272145655390244866
LucianoHuck,2020-06-14T01:57:09Z,"“Um mapa mundi q não inclua a utopia, nem vale a pena ser visto, pois deixa de fora o único país onde a Humanidade está sempre aportando. E qdo a Humanidade chegar lá, olha p/ o horizonte e, ao avistar outro país melhor, parte. O progresso é a realização de utopias.” Oscar Wilde",,,curious / curioso,Twitter for iPhone,pt,1271984994492321792
LucianoHuck,2020-06-14T01:51:10Z,"No final, revelei minha utopia: um governo + amoroso, capaz de tratar as pessoas com + carinho. É disso q precisamos p/ voltar a sorrir. Pode parecer ingênuo. E é. Mas s/ sonhos e esperanças não avançamos.",LucianoHuck,,curious / curioso,Twitter for iPhone,pt,1271983486023471104
LucianoHuck,2020-06-14T01:51:09Z,"Na minha opinião, as pessoas precisam voltar a ter esperança, a sonhar, a acreditar q a vida dos seus filhos será melhor q as suas.",LucianoHuck,,curious / curioso,Twitter for iPhone,pt,1271983484777771009
LucianoHuck,2020-06-14T01:51:09Z,"No bate-papo, manifestei entusiasmo c/ a participação de gente nova no debate político, como @anitta e @felipeneto. É sempre bom abrir o diálogo c/ pessoas q trazem outras perspectivas e estão dispostas a aprender.",LucianoHuck,,curious / curioso,Twitter for iPhone,pt,1271983483330727938
LucianoHuck,2020-06-14T01:51:09Z,Apanho dos extremos político. Deixo a minha zona de conforto quando me posiciono e enfrento a polarização. Mas está valendo. Pq as soluções não vão vir por geração espontânea. Todos precisam participar. E como cidadão cá estou.,LucianoHuck,,curious / curioso,Twitter for iPhone,pt,1271983481850138630
LucianoHuck,2020-06-14T01:51:08Z,O debate sobre renda básica domina a agenda global. Tenho conversado c/ pensadores q me ajudam a iluminar o caminho. Temos de endereçar esta questão com eficiência e afeto no BR. Tem jeito.,LucianoHuck,,curious / curioso,Twitter for iPhone,pt,1271983480411471872
LucianoHuck,2020-06-14T01:51:08Z,Todos concordamos com @esuplicy sobre a necessidade de viabilizar um projeto de renda básica universal sem abrir mão da responsabilidade de debater e encontrar formas economicamente viáveis e fiscalmente responsáveis.,LucianoHuck,,curious / curioso,Twitter for iPhone,pt,1271983478934994944
LucianoHuck,2020-06-14T01:51:07Z,"No bate-papo, ficou claro q a desigualdade é o nosso maior problema. Todos temos q buscar juntos uma saída estruturada p/
essa injustiça histórica. O 1% mais rico pode, deve e quer fazer muito + por esta causa.",LucianoHuck,,curious / curioso,Twitter for iPhone,pt,1271983477395726336
LucianoHuck,2020-06-14T01:51:07Z,"O quadro do BR é sério e requer amplo diálogo. Não é o caso de fulanizar nada. Mas o momento do país é angustiante.
Não é hora de politicagem.Temos de pensar e debater com seriedade políticas públicas p/ salvar vidas e empregos nesta pandemia.",,,curious / curioso,Twitter for iPhone,pt,1271983475109879815
LucianoHuck,2020-06-14T01:36:05Z,"Conversa excelente c/ @marinasilva, @gensantoscruz e @alessandromolon, em live do fórum Direitos Já!, mediada p/ @fefoguimaraes. O q nos aproxima é infinitamente maior do que o que nos separa.",,,curious / curioso,Twitter for iPhone,pt,1271979691335876613
LucianoHuck,2020-06-14T00:13:00Z,"O momento exige mente aberta, foco e união. Uma frente democrática representativa tem de ser o + ampla possível. @freire_roberto acerta ao defender a diversidade, uma unidade plural. https://t.co/0Hr7LxymAC",,,curious / curioso,Twitter for iPhone,pt,1271958784559243264
LucianoHuck,2020-06-13T21:00:34Z,Para quem quiser acompanhar será hoje as 19h. https://t.co/XeJ2OqoVaO,,,curious / curioso,Twitter for iPhone,pt,1271910356206653443
LucianoHuck,2020-06-13T13:49:47Z,"O 5G não é comunista nem capitalista. É uma tecnologia q tem de chegar logo. Politizar esse debate não ajuda. Governos devem se transformar em gdes plataformas digitais, se não correm o risco de não + governar. A inclusão digital é uma importante aliada no combate à desigualdade. https://t.co/1CqoAgnO4z",,,curious / curioso,Twitter for iPhone,pt,1271801944252862465
LucianoHuck,2020-06-13T13:41:39Z,"Enxergar soluções quando tudo parece ser problema é uma forma eficiente de mobilizar. Por isso, curti muito esta inciativa do @Estadao de destacar 10 boas notícias da semana. E hj tem episódio inédito do nosso noticiário de Esperança e Boas Notícias. https://t.co/iwERBCIYyL",,,curious / curioso,Twitter for iPhone,pt,1271799897633800192
LucianoHuck,2020-06-13T03:05:29Z,Parabéns pela iniciativa. E obrigado pelo convite. https://t.co/5nWlF4vUfN,,,curious / curioso,Twitter for iPhone,pt,1271639804103573506
LucianoHuck,2020-06-12T16:46:18Z,"Atenção ao alerta da
@CoiabAmazonia. A descoordenação no combate à Covid-19 põe em risco etnias inteiras. Povos indígenas estão ameaçados de desaparecer. https://t.co/CWSZFAtgdy",,,curious / curioso,Twitter for iPhone,pt,1271483980781629440
LucianoHuck,2020-06-12T14:13:25Z,Dia dos Namorados lembra a gente que toda forma de amar vale a pena. A linda história de Adriana e Alexon na @folha é prova disso.  Feliz dia dos namorados a todos que amam alguém. 🥰 https://t.co/wAUdqGjg5G,,,curious / curioso,Twitter for iPhone,pt,1271445507509030915
LucianoHuck,2020-06-12T14:11:40Z,Desrespeitar a Constituição é balbúrdia. Muito bom ver as instituições democráticas do Brasil em ação. Freios e contrapesos garantindo a ordem constitucional. https://t.co/Ol0K9Nzngq,,,curious / curioso,Twitter for iPhone,pt,1271445064988975104
LucianoHuck,2020-06-12T14:02:51Z,"O dia dos namorados. O nosso dia. O dia de agradecer o nosso encontro. O dia para celebrar nosso amor. Um amor a prova de isolamento. Que quanto mais juntos ficamos, mais tempo investimos na sua construção, e cada… https://t.co/ncuF7DvdpC",,,curious / curioso,Instagram,pt,1271442846378274818
LucianoHuck,2020-06-12T02:12:36Z,Não dá para engatar marcha à ré no Brasil em pleno 2020. Ainda mais quando se trata de educação e formação. Impôr reitores biônicos atropela a autonomia universitária. Trata um assunto de Estado c/ ideologia antidemocrática. Ignora o poder transformador da Educação.,,,curious / curioso,Twitter for iPhone,pt,1271264105987477506
LucianoHuck,2020-06-11T18:59:19Z,"O debate sobre a viabilidade da renda básica ganha corpo. Bandeira histórica de @esuplicy, agora com mais densidade crítica. Hoje na @folha Fernando Schüler dá sua contribuição. https://t.co/G8I2VtHTVv",,,curious / curioso,Twitter for iPhone,pt,1271155068486770694
LucianoHuck,2020-06-11T18:03:17Z,Obrigado Joao. Gostei muito. ;) https://t.co/H4IeUoP0H2,,,curious / curioso,Twitter for iPhone,pt,1271140965051502593
LucianoHuck,2020-06-11T13:08:51Z,Meu Instagram é todo seu @pretozeze. Amplificando vozes e mensagem muito importantes. https://t.co/S8B7T1g4KD,,,curious / curioso,Twitter for iPhone,pt,1271066866962874369
LucianoHuck,2020-06-11T13:04:27Z,Recomendo o artigo do professor Paulo Nassar e do jornalista Hamilton dos Santos na @folha. A verdade emancipa. A liberdade de imprensa é fundamental p/ democracia e traz prosperidade p/ sociedade. https://t.co/iS3cIc9VQ7,,,curious / curioso,Twitter for iPhone,pt,1271065760610365442
LucianoHuck,2020-06-11T13:03:56Z,https://t.co/kZYUFpPblV,,,curious / curioso,Twitter for iPhone,,1271065630960164864
LucianoHuck,2020-06-11T13:02:57Z,"Neste feriado, @pretozeze ocupa meu Instagram com uma programação poderosa. Como diz o PR da Cufa Global, é preciso diminuir distâncias e somar esforços e saberes pra construir 1 mundo + justo e igualitário. Boto fé. Vai la dar uma olhada; @LucianoHuck no Instagram.",,,curious / curioso,Twitter for iPhone,pt,1271065382267338752
LucianoHuck,2020-06-11T01:38:04Z,"Terminamos a conversa c/ a aposta de Ashton de que, no pós-pandemia, a indústria do entretenimento vai investir em conteúdos + leves, como as comédias românticas. Faz sentido: rir é mesmo muito bom p/ saúde.",LucianoHuck,,curious / curioso,Twitter for iPhone,pt,1270893026743902209
LucianoHuck,2020-06-11T01:38:03Z,"Estamos alinhados sobre o futuro do serviço público, q passa pela chave da tecnologia. Os governos q se mantiverem desconectados vão perder a capacidade d governar.",LucianoHuck,,curious / curioso,Twitter for iPhone,pt,1270893025250684928
LucianoHuck,2020-06-11T01:38:03Z,Concordei c/ ele e disse q a pandemia escancarou a desigualdade no Brasil. Temos mais d 30 milhões d pessoas s/ acesso a água p/ lavar as mãos e se proteger do coronavírus.,LucianoHuck,,curious / curioso,Twitter for iPhone,pt,1270893023866601473
LucianoHuck,2020-06-11T01:38:03Z,Ashton manifestou preocupação c/ a falta d lideranças capazes d promover a confiança social e d reduzir a disparidade econômica no mundo.,LucianoHuck,,curious / curioso,Twitter for iPhone,pt,1270893022666948610
LucianoHuck,2020-06-11T01:38:02Z,"Outro tema q abordamos foi a violência sexual contra crianças e adolescentes. @aplusk tem 2 iniciativas de combate a este crime terrivel. Que com inteligência artificial, ajuda a identificar criminosos q postam anúncios na internet p/ explorar a pornografia infantil.",LucianoHuck,,curious / curioso,Twitter for iPhone,pt,1270893021274542092
LucianoHuck,2020-06-11T01:38:02Z,"Segundo @aplusk, o distanciamento social, além d muita tristeza, desencadeou processos d inovação em áreas como telemedicina e educação à distância.",LucianoHuck,,curious / curioso,Twitter for iPhone,pt,1270893019911380994
LucianoHuck,2020-06-11T01:38:02Z,"No bate-papo, @aplusk contou sobre seu projeto #QuarantineWine, q já destinou 1,5 milhão de dólares em venda de vinho p/ recuperação d pacientes da Covid-19 e compra d equipamentos de proteção.",LucianoHuck,,curious / curioso,Twitter for iPhone,pt,1270893018405646337
LucianoHuck,2020-06-11T01:38:01Z,"Além de ator, Kutsher é fundador d um fundo d investimentos q investe entre outras coisas, em soluções tecnológicas p/ questões sociais e d defesa dos direitos humanos.",LucianoHuck,,curious / curioso,Twitter for iPhone,pt,1270893016891494402
LucianoHuck,2020-06-11T01:38:01Z,"Papo ótimo com Ashton Kutcher, o @aplusk, em live no canal da @BrazilatSV. Falamos sobre projetos d inovação, empreendedorismo e uso d tecnologias p/ ações sociais e combate à pandemia. (+) https://t.co/Lv2LXitSGL",,,curious / curioso,Twitter for iPhone,pt,1270893014379106304
LucianoHuck,2020-06-10T19:36:10Z,"Daqui a pouco, as 17:30h; uma conversa ao vivo com Ashton Kutsher @aplusk Quem quiser acompanhar; https://t.co/BU8HbLFic6",,,curious / curioso,Twitter for iPhone,pt,1270801953879195648
LucianoHuck,2020-06-10T19:18:00Z,"Minha solidariedade à repórter Marina Araújo, feita refém hj na @RedeGlobo. Episodio covarde, triste, deplorável. Espero q ela esteja bem. Uma barbárie contra todos nós da comunicação. Marina Araújo representa a imprensa, que defende uma sociedade livre, pacífica e democrática.",,,curious / curioso,Twitter for iPhone,pt,1270797379105669120
LucianoHuck,2020-06-10T15:12:13Z,"Conselho ajuda, exemplo arrasta.  Espero que esta iniciativa avance. https://t.co/P7dtPaQYSy",,,curious / curioso,Twitter for iPhone,pt,1270735526455377920
