screen_name,created_at,text,in_reply_to_screen_name,retweeted_status_screen_name,user_description,source,lang,id
LucianoHuck,2016-12-10T19:13:31Z,Familia #saltibum! É muito bom fazer amigos quando estamos trabalhando! É muito bom mesmo sendo… https://t.co/noj7RszWWD,,,curious / curioso,Instagram,pt,807664560723337216
LucianoHuck,2016-12-10T19:05:52Z,"Twitolândia, qq coisa to aqui, conectado.",,,curious / curioso,Twitter for iPhone,pt,807662634120204292
LucianoHuck,2016-12-10T18:55:45Z,RT @thiaguinhocomth: Aeeeeee!!! COLOCA NO Caldeirão do @lucianohuck Meu irmão!!!!! Ficou demais nossa matéria hoje!!!… https://t.co/HgFhcBSg8s,,thiaguinhocomth,curious / curioso,Twitter for iPhone,pt,807660087640780801
LucianoHuck,2016-12-08T20:13:31Z,Foram dias incríveis de kite em Maracaipe. Recomendo. Partiu Recife. Partiu #caldeirão. Valeu… https://t.co/X7ubhMYDB1,,,curious / curioso,Instagram,pt,806954885413564416
LucianoHuck,2016-12-08T02:40:00Z,"Pirei nas imagens. Meu amigo querido @geninhosimonett fez estas imagens pica das galaxias,… https://t.co/j15OBJbBzt",,,curious / curioso,Instagram,pt,806689757728276480
LucianoHuck,2016-12-07T11:27:20Z,Eta esporte bom. #kite #brisas #pernambuco @ Pontal de Maracaípe https://t.co/z3Ccl0s1he,,,curious / curioso,Instagram,pt,806460078681366529
LucianoHuck,2016-12-05T21:10:20Z,"Alguém aí tem uma história de amor incrível para indicar pro Lata Velha em Recife? Se sim, pf, posta no meu Facebook (lucianohuck). Bjs L",,,curious / curioso,Twitter for iPhone,pt,805882020836544512
LucianoHuck,2016-12-05T01:42:00Z,Não canso de assistir e ouvir esta canção. Coisa linda. #finaldeanonoCaldeirão https://t.co/ZNQ8vmMcFD,,,curious / curioso,Twitter for iPhone,pt,805587996565274628
LucianoHuck,2016-12-03T20:44:52Z,"O que foi @luansantana cantando com a talentosa @ahnaoaninha, a musica ""Trem Bala"" composta por… https://t.co/9Q0vBW1tC2",,,curious / curioso,Instagram,pt,805150833365098498
LucianoHuck,2016-12-03T20:35:45Z,Ficou linda demais a musica da Ana Vilela e @luansantana 👏🏻👏🏻👏🏻👏🏻👏🏻 #caldeirão,,,curious / curioso,Twitter for iPhone,pt,805148540267876353
LucianoHuck,2016-11-30T11:44:10Z,Hj é o dia dela. Amor da minha vida. Mãe dos nossos filhos. Parceira para a vida toda.… https://t.co/FhN35ziheu,,,curious / curioso,Instagram,pt,803927600779460609
LucianoHuck,2016-11-29T22:30:39Z,Tira um selfie comigo? Claro. 😱 @ Programa Caldeirão Do Huck https://t.co/WKdbDUAcjV,,,curious / curioso,Instagram,pt,803727902965714946
LucianoHuck,2016-11-29T10:40:18Z,"Pelas famílias, pelos amigos, pelo futebol, pelo esporte. Que tristeza. Que tragégia. https://t.co/HKICfvUgwC",,,curious / curioso,Instagram,pt,803549139464257536
LucianoHuck,2016-11-29T10:37:55Z,"Precisamos turbinar a cultura da doação no Brasil, isso pode fazer uma enorme diferença. É… https://t.co/HSXKmrkedv",,,curious / curioso,Instagram,pt,803548539573911552
LucianoHuck,2016-11-29T09:50:06Z,"Que tristeza, que tragédia! #chapecoense",,,curious / curioso,Twitter for iPhone,pt,803536505545302016
LucianoHuck,2016-11-27T14:39:06Z,"Direto do espaço para o Cristo Redentor. O astronauta Chris Cassidy, no Rio dps de 6 meses no… https://t.co/OtknfXKVNi",,,curious / curioso,Instagram,pt,802884457149644801
LucianoHuck,2016-11-26T20:58:59Z,Obrigado a todos. Por tantas mensagens. Valeu mesmo. O casal agradece. #caldeirão… https://t.co/LkZ39mVPH2,,,curious / curioso,Instagram,pt,802617673133805569
LucianoHuck,2016-11-26T20:44:21Z,"Vou fazer um ""live"" no Facebook. Ao vivo aqui de casa. Agora. Se quiser, vai la no meu face: luciano huck",,,curious / curioso,Twitter for iPhone,pt,802613989062676480
LucianoHuck,2016-11-26T20:38:22Z,Kkkkkkk #caldeirão https://t.co/Z8iyB5sdrW,,,curious / curioso,Twitter QandA,,802612483022209024
LucianoHuck,2016-11-26T20:37:29Z,Tb adoro fazer #caldeirão https://t.co/Qx9y1wVAXD,,,curious / curioso,Twitter QandA,pt,802612263022694403
LucianoHuck,2016-11-26T20:33:12Z,Kkkkk...37 anos depois: Helen Mara &amp; @angelicaksy #visitandoopassado #caldeirão @ Tv Globo https://t.co/csitD3GJl4,,,curious / curioso,Instagram,pt,802611182372786176
LucianoHuck,2016-11-26T19:58:31Z,"Muito orgulho da história, carreira e a mulher maravilhosa que ela é. #visitandoopassado… https://t.co/2ZlKR3puAW",,,curious / curioso,Instagram,pt,802602455381016577
LucianoHuck,2016-11-26T19:52:14Z,🙏🏻 #caldeirão https://t.co/wq8tdX8r5n,,,curious / curioso,Twitter QandA,,802600875424256000
LucianoHuck,2016-11-26T19:52:02Z,Hehehe #caldeirão https://t.co/MrB4PcDDXx,,,curious / curioso,Twitter QandA,tl,802600821900722177
LucianoHuck,2016-11-26T19:51:50Z,Valeu valeu #caldeirão https://t.co/pyhexez2bl,,,curious / curioso,Twitter QandA,ht,802600772391280640
LucianoHuck,2016-11-26T19:51:28Z,Eu tb rs #caldeirão https://t.co/p8nIo74EXb,,,curious / curioso,Twitter QandA,pt,802600680326397952
LucianoHuck,2016-11-26T19:49:40Z,Caldeirão no ar e eu aqui #caldeirão,,,curious / curioso,Twitter QandA,pt,802600228671066112
LucianoHuck,2016-11-26T19:48:06Z,Valeu valeu hehehe https://t.co/z5M3TBzMRB,,,curious / curioso,Twitter for iPhone,pt,802599831265046530
LucianoHuck,2016-11-26T18:18:51Z,"Tô na área. Qq coisa, só escrever....",,,curious / curioso,Twitter for iPhone,pt,802577372415401984
LucianoHuck,2016-11-26T15:41:44Z,A vida como ela é. Cabe a nós ajudar a transformar. #caju #afroreggae #centrocultural… https://t.co/yZouQ5RCX2,,,curious / curioso,Instagram,pt,802537833701474304
LucianoHuck,2016-11-26T10:12:34Z,"É hoje. Feliz, emocionado e honrado com a homenagem que estou recebendo do Grupo Cultural… https://t.co/JaiNdICeao",,,curious / curioso,Instagram,pt,802454994272350208
LucianoHuck,2016-11-25T15:46:46Z,"Hoje acordei me sentido um gigante. rs Quinto estado, sexta cidade em 5 dias. Para uma semana ta… https://t.co/VoHfW39Gq3",,,curious / curioso,Instagram,pt,802176713371385860
LucianoHuck,2016-11-25T00:39:18Z,"Papo com a familia #cocacola. Valeu pela acolhida. Foi ótimo. Adorei. @ Rio de Janeiro, Brazil https://t.co/CRmr19cHKJ",,,curious / curioso,Instagram,pt,801948339478609920
LucianoHuck,2016-11-23T16:41:20Z,"Valeu Amparo. Valeu pelo carinho. 4ª cidade, 3º estado em 3 dias. 😅 #caixeiroviajante #ypê… https://t.co/Giz58DFvaZ",,,curious / curioso,Instagram,pt,801465667379752960
LucianoHuck,2016-11-23T11:09:50Z,E lá vamos nós...terceiro estado em 3 dias nesta semana. 😅,,,curious / curioso,Twitter for iPhone,pt,801382245038694400
LucianoHuck,2016-11-22T22:00:59Z,Valeu valeu!!!!! https://t.co/ftWlZXTokU,,,curious / curioso,Twitter for iPhone,ht,801183721491529728
LucianoHuck,2016-11-22T19:41:29Z,"Valeu Fortaleza. Meu dia foi muito especial. Volto em breve, prometo. Adoro o Ceará. Sem… https://t.co/HPjJgkRNI9",,,curious / curioso,Instagram,pt,801148615251136512
LucianoHuck,2016-11-22T12:06:12Z,#ceara #fortaleza #omundogiraeeurodo @ Serviluz https://t.co/fzTOE3LjlW,,,curious / curioso,Instagram,es,801034040375648256
LucianoHuck,2016-11-22T12:03:10Z,"Capa do nosso disco...kkkk Fortaleza, tô na área. Indo gravar na Rua Mário Filho, 1010
Novo… https://t.co/lF2mx1H9So",,,curious / curioso,Instagram,pt,801033278757240832
LucianoHuck,2016-11-22T11:27:57Z,"Bom dia, Fortaleza! Tô na área! Daqui a pouco vou estar gravando na
Rua Mário Filho, 1010
Novo Mondubim. Apareçam. Bjs L",,,curious / curioso,Twitter for iPhone,pt,801024414049517568
LucianoHuck,2016-11-20T00:00:54Z,"Viatura atacada, helicoptero derrubado...a cidade não era maravilhosa? Que tristeza que dá!",,,curious / curioso,Twitter for iPhone,pt,800126739104022529
LucianoHuck,2016-11-19T21:07:53Z,"E para quem não assistiu ao #caldeirão na programação Globo, ai vão os links de todos os… https://t.co/EL2pIOSq3T",,,curious / curioso,Instagram,pt,800083198147325952
LucianoHuck,2016-11-19T20:47:56Z,Ah...vou fazer um live no Facebook agora. Anima? Só entrar na minha pagina la. Bjs e ate ja,,,curious / curioso,Twitter for iPhone,pt,800078176982593536
LucianoHuck,2016-11-19T20:47:15Z,Muuuuuito obrigado a todos que assistiram ao #caldeirão de hj. E fizeram tweets a respeito!!! #caldeirão #latavelha #praiagrande,,,curious / curioso,Twitter for iPhone,pt,800078003707314176
LucianoHuck,2016-11-19T20:37:43Z,"Valeu Tanja! Valeu Seu Luiz! Valeu Dona Vera! E daqui para frente, cuidem da relação de vcs, pai… https://t.co/OehlspdZHF",,,curious / curioso,Instagram,pt,800075606503231488
LucianoHuck,2016-11-19T13:00:38Z,"É neste sábado!!!! O #caldeirão esta bem legal!!! No #latavelha, a história foi se transformando… https://t.co/fdJ2hUqWE4",,,curious / curioso,Instagram,pt,799960576306847744
LucianoHuck,2016-11-19T13:00:33Z,Just posted a photo https://t.co/CjoAktFgHR,,,curious / curioso,Instagram,en,799960556954337281
LucianoHuck,2016-11-18T18:34:40Z,"Se vc quiser participar do mutirão do #umportodosetodosporum, aqui vai o endereco do projeto… https://t.co/x0hoUQ3DMn",,,curious / curioso,Instagram,pt,799682248790409217
LucianoHuck,2016-11-18T14:15:47Z,"Fiquei super feliz e lisonjeado com a homenagem do Afroreggae. Somos parceiros a muitos anos,… https://t.co/2zUJ5cOl3I",,,curious / curioso,Instagram,pt,799617100708909061
LucianoHuck,2016-11-18T02:25:14Z,Como sempre...rolo de rir com o #adnight. Parabens @MarceloAdnet &amp; cia!!!!,,,curious / curioso,Twitter for iPhone,pt,799438284988514304
LucianoHuck,2016-11-17T02:10:58Z,"Ota, amigo querido! Valeu por emprestar sua bancada só hj. Nos divertimos. Bjaooooo https://t.co/5Xw98ov4LQ",,,curious / curioso,Twitter for iPhone,pt,799072307989856260
LucianoHuck,2016-11-17T02:06:08Z,Nossa versão #Andyiscoming #andyestachegando!!!! Kkkkk #videoshow https://t.co/KNl1mVMEjb,,,curious / curioso,Twitter for iPhone,pt,799071090312146944
LucianoHuck,2016-11-17T02:02:59Z,Twittolandia!!! Passei o dia enfiado no estúdio e nem consegui agradecer as milhares de mensagens do hj durante o #videoshow. Mt obrigado. 😘,,,curious / curioso,Twitter for iPhone,pt,799070296758190080
LucianoHuck,2016-11-16T16:24:24Z,Alguem quer mandar algum recado ao vivo aqui no #videoshow? Hehehe,,,curious / curioso,Twitter for iPhone,pt,798924693252304896
LucianoHuck,2016-11-16T02:50:26Z,"Voltando para casa! Bye bye NYC! Amanhã ""é nóis"" no #videoshow ao vivo! ❤️@angelicaksy @ John F.… https://t.co/tRmA7odemC",,,curious / curioso,Instagram,pt,798719848427626496
LucianoHuck,2016-11-16T01:37:29Z,"Aos empreendedores de plantão, recomendo o livro do @prof_malhotra. Trata-se de um prof de Harvard que admiro muito. https://t.co/30dUdSpLF9",,,curious / curioso,Twitter for iPhone,pt,798701493192888320
LucianoHuck,2016-11-15T15:55:06Z,Jogou muito este ano. Merece. #tmj https://t.co/JXCr4z0zdk,,,curious / curioso,Instagram,pt,798554932127395840
LucianoHuck,2016-11-13T22:32:32Z,"Últimos dias de votação do Prêmio Extra de Tv, estou correndo em uma das categorias, se vcs… https://t.co/Mx9qOOFx4U",,,curious / curioso,Instagram,pt,797930170766065664
LucianoHuck,2016-11-13T05:51:47Z,"👏🏻👏🏻👏🏻👏🏻 @soujorge arrebentando em NYC. Ingressos esgotados, gringalhada pagando pau e no palco… https://t.co/LF5SL1xvU1",,,curious / curioso,Instagram,pt,797678323811971072
LucianoHuck,2016-11-12T21:35:24Z,"Valeu, turma!!! Sempre!!!! https://t.co/3jw0Opn9M7",,,curious / curioso,Twitter for iPhone,pt,797553405531160576
LucianoHuck,2016-11-12T21:28:25Z,Dona Maria da Penha brilhou hj no #caldeirão!!!! Valeu @wesleysafadao por topar sempre a idéias… https://t.co/DfVnFmLW3h,,,curious / curioso,Instagram,pt,797551649350971392
LucianoHuck,2016-11-12T21:21:57Z,"Eu &amp; Johan no AquaRio. Adorei ter feito esta matéria, ter contato estas histórias! #caldeirão… https://t.co/r99KVyiKK3",,,curious / curioso,Instagram,pt,797550019322806273
LucianoHuck,2016-11-09T14:44:58Z,Gastei todo meu ingles...rs Papo com super diretor Oliver Stone em frente a 5000 pessoas no HSM… https://t.co/15noh6FqQR,,,curious / curioso,Instagram,pt,796362952752451584
LucianoHuck,2016-11-07T18:15:56Z,"A minha semana começou no Sul. Carlos Barbosa, tô na área. To tipo caixeiro viajante. Mas é um… https://t.co/6KlNEKF2FG",,,curious / curioso,Instagram,pt,795691271150940160
LucianoHuck,2016-11-06T18:47:43Z,"Hoje a festa é sua, hoje a festa é nossa.....demos risada com esta turma!!!!! #acabouoano @… https://t.co/EbfXgdvAVc",,,curious / curioso,Instagram,pt,795336880770445312
LucianoHuck,2016-11-05T20:41:57Z,"Decidi agora, vou fazer um ""ao vivo"" no meu facebook (lucianohuck)...vai la e falamos ""live"". Daqui 10 min.",,,curious / curioso,Twitter for iPhone,pt,795003240056258560
LucianoHuck,2016-11-05T20:40:37Z,"Muito obrigado a esta montão de gente, que esteve comigo durante o #caldeirão",,,curious / curioso,Twitter for iPhone,pt,795002904696459264
LucianoHuck,2016-11-05T20:30:46Z,"Em um momento em que o Brasil esta vivendo um momento tão delicado da sua história política,… https://t.co/zv73ZQaLtL",,,curious / curioso,Instagram,pt,795000424105394176
LucianoHuck,2016-11-05T19:51:35Z,🙏🏻 https://t.co/cHk2h21ZGq,,,curious / curioso,Twitter QandA,,794990565880451072
LucianoHuck,2016-11-05T19:48:43Z,É agora https://t.co/x2x28vQUCn,,,curious / curioso,Twitter QandA,pt,794989844715945985
LucianoHuck,2016-11-05T19:48:13Z,Obrigado Ana 😘 https://t.co/JppbeiL6j3,,,curious / curioso,Twitter QandA,pt,794989716131221504
LucianoHuck,2016-11-05T19:47:53Z,Kkkkkk https://t.co/W8tqyFbma1,,,curious / curioso,Twitter QandA,,794989633163718658
LucianoHuck,2016-11-05T19:47:40Z,Valeu Sandra https://t.co/DuWzc92mN1,,,curious / curioso,Twitter QandA,pt,794989580625776640
LucianoHuck,2016-11-05T19:46:44Z,Sorry. Rs 😬 https://t.co/YwkEzLNkTv,,,curious / curioso,Twitter QandA,en,794989346231291904
LucianoHuck,2016-11-05T19:46:01Z,É agora...#visitandoopassado com o @pefabiodemelo!!! #caldeirao,,,curious / curioso,Twitter for iPhone,pt,794989163204509701
LucianoHuck,2016-11-05T19:31:03Z,"Adoro o #saltibum. E ainda mais com uma visita bacanuda como esta, sempre bem vindo querido… https://t.co/vDYT898DVK",,,curious / curioso,Instagram,pt,794985397491273728
LucianoHuck,2016-11-05T18:37:22Z,"Qq coisa, to aqui...conectado.",,,curious / curioso,Twitter for iPhone,pt,794971886656638977
LucianoHuck,2016-11-05T18:37:01Z,Adorei a Paola Oliveira e o Pedro Safa no #caldeirao. Dei risadas,,,curious / curioso,Twitter for iPhone,pt,794971798249029632
LucianoHuck,2016-11-05T13:16:51Z,Ja fiz a minha doação. E vc? Contribua; afinal são duas inteligências sérias e confiáveis… https://t.co/mmMBBpdJkf,,,curious / curioso,Instagram,pt,794891227132882944
LucianoHuck,2016-11-05T13:06:09Z,Cleverson Carlos anunciando que hj tem @pefabiodemelo no #caldeirão kkkkkkk Vai ser d+. Espero… https://t.co/6IH3STB0cs,,,curious / curioso,Instagram,pt,794888533253058560
LucianoHuck,2016-11-04T02:04:55Z,A querida amiga @ivetesangalo é muito ponta firme. Hj no lindo show que fez em Salvador em prol… https://t.co/UMoqil1gyc,,,curious / curioso,Instagram,pt,794359742734958592
LucianoHuck,2016-11-04T01:29:54Z,Incrivel...@MarceloAdnet rimando é um monstro! 👏🏻👏🏻👏🏻👏🏻 #adnight,,,curious / curioso,Twitter for iPhone,pt,794350931085234176
LucianoHuck,2016-11-03T15:09:00Z,"Hoje é o dia desta cara! Nosso filho amado! Meu parceiro de papos, gargalhadas e aventuras!… https://t.co/1nAmhKkKmG",,,curious / curioso,Instagram,pt,794194673417863168
LucianoHuck,2016-10-31T19:23:08Z,"Seu Gaudino, viajar este Brasil inteiro, ir tão longe de casa, só vale a pena, por ter o… https://t.co/eWKTng4U4j",,,curious / curioso,Instagram,pt,793171465835347968
LucianoHuck,2016-10-31T19:19:53Z,Ainda sobre o evento da #perdigão na semana passada...a iniciativa é muito boa e estou feliz em… https://t.co/KL9bHknp5W,,,curious / curioso,Instagram,pt,793170646679293952
LucianoHuck,2016-10-31T15:59:08Z,Parte da diretoria reunida. Com cara de galã. rs Sempre juntos @thiaguinhocomth &amp;… https://t.co/4PoAT3G9Pe,,,curious / curioso,Instagram,pt,793120127529148416
LucianoHuck,2016-10-30T12:03:28Z,"12, doze, uma dúzia, décimo segundo, duodécimo, 3X4, XII....de muito amor, admiração, parceria e… https://t.co/kSTorobowm",,,curious / curioso,Instagram,pt,792698432666296320
LucianoHuck,2016-10-29T20:05:04Z,"E para quem não assistiu ao #caldeirão de hj na programação, ai vai o link:… https://t.co/3ezbPalUSV",,,curious / curioso,Instagram,pt,792457242532610048
LucianoHuck,2016-10-29T17:49:57Z,"To aqui, ao vivo, na twittolandia! Qq coisa, so falar.",,,curious / curioso,Twitter for iPhone,pt,792423238806728705
LucianoHuck,2016-10-28T23:41:54Z,"Vou assistir. Certo. Me amarro nesta turma, e como olham o mundo! #quemundoéesse #globonews https://t.co/Nt0Y26gnwp",,,curious / curioso,Instagram,pt,792149420959682560
LucianoHuck,2016-10-28T14:31:20Z,Nossa turma reunida. Amo este time. Fodásticos. Que venha 2017. #caldeirão #sinapses #ideias… https://t.co/rENF3CkMfI,,,curious / curioso,Instagram,pt,792010869072760832
LucianoHuck,2016-10-27T01:24:31Z,"Visita especial hj na gravação do #caldeirão, sempre bem vinda @Oliveiraspaola! Vai ficar bem… https://t.co/WJjLI2uoXa",,,curious / curioso,Instagram,pt,791450472439767040
LucianoHuck,2016-10-26T00:40:44Z,"Valeu Camaçari!!! Foi intenso!!! Bjao a todos!!!! L @ Camaçari - Bahia, Centro https://t.co/Zid5n5KzJK",,,curious / curioso,Instagram,pt,791077064086519808
LucianoHuck,2016-10-24T21:19:17Z,"Lá vem o Prêmio Extra de Televisão, e estou indicado como ""Melhor Apresentador"", se vcs puderem votar...agradeço.😬 https://t.co/9RZjgTQ4hg",,,curious / curioso,Twitter for iPhone,pt,790663982105362437
LucianoHuck,2016-10-23T23:43:22Z,Vc acha que este macaco esta com um semblante de felicidade? Ele é um dos 1300 moradores do… https://t.co/Tayaw3ymYo,,,curious / curioso,Instagram,pt,790337853343531008
LucianoHuck,2016-10-22T22:33:14Z,"E para quem não assistiu ao lindo &amp; inspirador #umportodosetodosporum, ai vai o link tb:… https://t.co/FGLv5qSDrl",,,curious / curioso,Instagram,pt,789957814148096000
LucianoHuck,2016-10-22T22:28:24Z,"Para quem não assistiu ao #saltibum na programaçao, ai vai o link: https://t.co/R8S6g3FzNk @ CEFAN… https://t.co/hf3nWycokZ",,,curious / curioso,Instagram,pt,789956597116203008
LucianoHuck,2016-10-22T19:39:40Z,"E começou o #saltibum!!!! Plataforma de 5 metros, masculina. #caldeirão",,,curious / curioso,Twitter for iPhone,pt,789914135744155648
LucianoHuck,2016-10-22T19:19:53Z,Salva de palmas para Dona Jurema &amp; toda a sua família!!!! 👏🏻👏🏻👏🏻👏🏻👏🏻👏🏻👏🏻👏🏻 👏🏻👏🏻👏🏻👏🏻👏🏻👏🏻👏🏻👏🏻👏🏻👏🏻… https://t.co/wk5DXuzDJY,,,curious / curioso,Instagram,pt,789909158762020865
LucianoHuck,2016-10-22T19:00:20Z,Dennis so nao passou nas cidades que tem horario eleitoral https://t.co/sEajaClkbn,,,curious / curioso,Twitter QandA,pt,789904235710283776
LucianoHuck,2016-10-22T18:59:51Z,Valeu Pedro https://t.co/QX1DUcJh5z,,,curious / curioso,Twitter QandA,pt,789904113597288448
LucianoHuck,2016-10-22T18:59:12Z,Historia linda mesmo https://t.co/elqSn6bZpR,,,curious / curioso,Twitter QandA,pt,789903950174625792
LucianoHuck,2016-10-22T18:44:40Z,"Estou MUITO bem acompanhado; Dona Jurema &amp; o respeitado Yann Arthus Bertrand, diretor do… https://t.co/iDFw94Nu4C",,,curious / curioso,Instagram,pt,789900295975407621
LucianoHuck,2016-10-22T18:33:32Z,Bj rs https://t.co/POqeaHyUKx,,,curious / curioso,Twitter QandA,pt,789897492594851840
LucianoHuck,2016-10-22T18:31:50Z,"Para quem estiver assistindo ao #caldeirão, qq coisa, estou por aqui, conectado tb. Ta?",,,curious / curioso,Twitter for iPhone,pt,789897065883131904
LucianoHuck,2016-10-20T21:28:18Z,Visita ilustre no #saltibum! Bem vinda sempre querida @Fernanda_Gentil! @ CEFAN - Centro de… https://t.co/0EGLAYhitQ,,,curious / curioso,Instagram,pt,789216699740479488
LucianoHuck,2016-10-19T20:12:20Z,"Ai esta...meu amigo @Mariano_MeM ""inteiro"". rs Ontem ele bateu a cabeça nos treinos do… https://t.co/eEbuGSBMKS",,,curious / curioso,Instagram,pt,788835193574621185
LucianoHuck,2016-10-16T22:37:01Z,Que lua. Sem filtro da janela do nosso quarto. 🙏🏻 https://t.co/eWfSU4BnKy,,,curious / curioso,Instagram,pt,787784442177843200
LucianoHuck,2016-10-16T00:31:49Z,Ai vai a íntegra do #caldeirão de hj: https://t.co/AjfkSL3Upx,,,curious / curioso,Twitter for iPhone,pt,787450942149058560
LucianoHuck,2016-10-16T00:30:47Z,Bruno Chateaubriand assume liderança do ranking masculino do 'Saltibum'; veja todos os saltos https://t.co/xc8Oe5o2vl,,,curious / curioso,Twitter for iPhone,pt,787450682957819905
LucianoHuck,2016-10-16T00:30:00Z,'Saltibum': roxos na perna de Carol Barcellos são destacados na redes;  https://t.co/gyND4CMMHe,,,curious / curioso,Twitter for iPhone,pt,787450486647652352
LucianoHuck,2016-10-16T00:28:46Z,"""Ao Mestre com Carinho' estreia no 'Caldeirão' com homenagem no Dia do Professor https://t.co/BjKHJ9d8NJ",,,curious / curioso,Twitter for iPhone,pt,787450172993339392
LucianoHuck,2016-10-15T20:26:16Z,"Obrigado e parabens a todos os alunos do Colégio Estadual Oscar Batista de São João do Paraiso,… https://t.co/9sMgRY9v4H",,,curious / curioso,Instagram,pt,787389146327347202
LucianoHuck,2016-10-14T05:01:39Z,"Obrigado, querido Jô!!! Adoramos!!!! https://t.co/vnwsHCR9Iu",,,curious / curioso,Instagram,pt,786794071821996032
LucianoHuck,2016-10-14T03:23:18Z,Dando risada com o #adnight! Boa @MarceloAdnet @oceara @Lhassum @marcoluque 👏🏻👏🏻👏🏻👏🏻👏🏻👏🏻,,,curious / curioso,Twitter for iPhone,pt,786769323545198592
LucianoHuck,2016-10-13T20:42:43Z,"Hj tem ""nóis"" no Programa do Jô! Conversa boa! Até mais tarde! Bjs a todos! https://t.co/UuzYkDiNiz",,,curious / curioso,Instagram,pt,786668511473102848
LucianoHuck,2016-10-12T17:37:21Z,"Resolvi postar esta imagem hj, para lembrar que no Haiti hj não é o dia das crianças, mas… https://t.co/tpDJw1q1y0",,,curious / curioso,Instagram,pt,786259473858002945
LucianoHuck,2016-10-12T14:36:57Z,"Feliz Dia das Crianças! Qdo meu pai ou minha mãe - não sei bem ao certo quem tirou esta chapa,… https://t.co/CxkgADP8vL",,,curious / curioso,Instagram,pt,786214075676131328
LucianoHuck,2016-10-11T21:33:48Z,"É ""nóis"" com o amado Jô! Sempre muito bom estar com ele! E nunca tinhamos tido um papo os 3 na… https://t.co/pN1SC3t1kz",,,curious / curioso,Instagram,pt,785956591535136769
LucianoHuck,2016-10-11T15:31:05Z,Nada como pensar fora da caixa! 💡 #praiagrande #SP #latavelha #caldeirão @ Praia Grande https://t.co/8awnzeMP3z,,,curious / curioso,Instagram,pt,785865309215420417
LucianoHuck,2016-10-10T22:36:39Z,Muito bom!!!! Kkkkkk https://t.co/m2C7LAFG3e,,,curious / curioso,Twitter for iPhone,pt,785610018938884096
LucianoHuck,2016-10-10T11:38:42Z,Eu e minha pequena. Amor maior do mundo. #familia #dandovalor @ São Bento Sorocaba https://t.co/EYVwPma64Q,,,curious / curioso,Instagram,pt,785444442660536320
LucianoHuck,2016-10-09T01:24:55Z,"Valeu a todos que estiveram com a gente, durante o #caldeirão de hj! Espero que tenham curtido!… https://t.co/aZQB0l5WDn",,,curious / curioso,Instagram,pt,784927589357854720
LucianoHuck,2016-10-08T17:58:54Z,"Adorei contar sua história Paulinho. Tamo junto. Saúde, saúde, saúde. E a vc que esta lendo este… https://t.co/aA1QY6Nms3",,,curious / curioso,Instagram,pt,784815348763811842
LucianoHuck,2016-10-08T01:33:03Z,Hj fui visitar o oibere no @manualdomundo! Me amarro no criativo trabalho dele! @ Butantã https://t.co/vsgQZ8hd2w,,,curious / curioso,Instagram,pt,784567247578726400
LucianoHuck,2016-10-08T00:02:48Z,Muito triste pelo Haiti,,,curious / curioso,Twitter for iPhone,pt,784544536957685760
LucianoHuck,2016-10-07T23:58:47Z,"Amanhã estreia o #saltibum! Espero vcs! Em SP as 2pm, no resto do Brasil as 3:30pm. https://t.co/xGroZJUqyO",,,curious / curioso,Twitter for iPhone,pt,784543524834467844
LucianoHuck,2016-10-07T23:42:48Z,Amanhã tem estreia do #saltibum. Esta muito legal! #caldeirão,,,curious / curioso,Twitter for iPhone,pt,784539503029547008
LucianoHuck,2016-10-07T23:35:54Z,Adoro vcs @antoniotabet @gduvivier @iansbf! Papo bom como sempre! Boas risadas! Boas idéias! https://t.co/M71LvSwDVt,,,curious / curioso,Instagram,pt,784537765862137857
LucianoHuck,2016-10-05T01:24:58Z,"Esta é a Mariana, ela tinha apenas 13 anos. Hoje Deus a levou. Mari estava, há 6 meses, a espera… https://t.co/Zskv3izaIg",,,curious / curioso,Instagram,pt,783478051552235520
LucianoHuck,2016-10-02T10:45:01Z,"Nesta manhã fria &amp; chuvosa de domingo, quem quiser conferir o #caldeirão de ontem...ai vai o… https://t.co/fRaefrnHDh",,,curious / curioso,Instagram,pt,782531828662013952
LucianoHuck,2016-10-01T23:02:42Z,Meu caro @Rene_Silva_RJ. Estou por perto p/ o q der e vier. Queremos explicações e todo o equipamento de volta e intacto. https://t.co/V0yXQe6i6A,,,curious / curioso,Twitter for iPhone,pt,782355083430420480
LucianoHuck,2016-10-01T23:00:02Z,Soube q o @Rene_Silva_RJ da #vozdacomunidade foi arbitrariamente preso durante uma reportagem no #complexodoalemão. Um absurdo.,,,curious / curioso,Twitter for iPhone,pt,782354416485761025
LucianoHuck,2016-10-01T22:57:03Z,Um aperitivo do #saltibum q estreia na semana q vem! 🤘🏻 https://t.co/dzArA0RMp3,,,curious / curioso,Twitter for iPhone,pt,782353662203072512
LucianoHuck,2016-10-01T20:19:40Z,"rs...muita gente ta como eu hj, aqui no twitter. Bjs a todos",,,curious / curioso,Twitter for iPhone,pt,782314058573815810
LucianoHuck,2016-10-01T20:18:40Z,Boa...quem quiser bater um papo abre na minha página no Face. To indo la.,,,curious / curioso,Twitter for iPhone,pt,782313805430874113
LucianoHuck,2016-10-01T20:18:00Z,"Chuva, frio, sob as cobertas...e o #caldeirao ja terminou...ja sei vou fazer um Facetime ao vivo",,,curious / curioso,Twitter for iPhone,pt,782313636345868289
