screen_name,created_at,text,in_reply_to_screen_name,retweeted_status_screen_name,user_description,source,lang,id
LucianoHuck,2019-01-19T08:12:35Z,"A caminho do @WEFBookClub. Sigo na cruzada pelo aprendizado e conhecimento. Poder compartilhar ideias, ouvir e falar, em um ambiente como este, só vem a fortalecer a crença, que não… https://t.co/3auAV1ejxS",,,curious / curioso,Instagram,pt,1086536886238117888
LucianoHuck,2019-01-15T20:52:20Z,"Registro meu respeito e admiração pelo @Gen_VillasBoas.  Pela importante liderança enquanto comandou o exército brasileiro. Agradeço ao @rafaelmedeirosfotografo, pelo registro do dia em que nos conhecemos, quando nasceu uma boa amizade, pela qual tenho enorme orgulho. https://t.co/8hnoLQvArQ",,,curious / curioso,Twitter for iPhone,pt,1085278534350835712
LucianoHuck,2019-01-15T16:20:30Z,O longa do meu irmão @grosteinandrade foi selecionado p/ o @sundancefest. Aqui vai o link do “meet the artist” dele: https://t.co/15F2BC3rUL,,,curious / curioso,Twitter for iPhone,pt,1085210125063933952
LucianoHuck,2019-01-15T09:18:00Z,"Conselho ajuda, exemplo arrasta. Queremos criar filhos capazes de enxergar além dos próprios umbigos, dispostos a melhorar o mundo a sua volta. #ferias #dandovalor #moçambique… https://t.co/xFvI6hNyCo",,,curious / curioso,Instagram,pt,1085103799696588801
LucianoHuck,2019-01-12T16:31:43Z,"E com esta imagem dos nossos filhos correndo pelas lindíssimas ilhas de Moçambique, nos despedimos deste lugar tão especial. Terra de contrastes, paisagens de tirar o fôlego, um povo… https://t.co/rZD4n5FPwa",,,curious / curioso,Instagram,pt,1084125783784935425
LucianoHuck,2019-01-12T07:41:46Z,Hoje estreia a segunda temporada do The Wall. Ficou muito legal. Espero que vcs curtam. Boas histórias e desafio emocionante. #caldeirao #thewall https://t.co/5GewU7n7Uh,,,curious / curioso,Instagram,pt,1083992415567003649
LucianoHuck,2019-01-12T07:22:11Z,família + ferias + Moçambique + drone + barco (o único na praia) = este registro. 🙏🏻 https://t.co/LPiJMzaZ6C,,,curious / curioso,Instagram,pt,1083987488677478403
LucianoHuck,2019-01-11T07:37:46Z,Boa reflexão de @MatiasSpektor. Que os necessários projetos reformistas de Paulo Guedes e Sergio Moro não sirvam de cortina de fumaça p/ possíveis retrocessos e equívocos na politica externa tão importante para o país. https://t.co/E6DELE9kOn,,,curious / curioso,Twitter for iPhone,pt,1083629021638737920
LucianoHuck,2019-01-10T20:54:36Z,"Mercado Central. Vilankulo. Moçambique. #cadavezgostomaisdemoçambique em Vilankulo, Inhambane, Mozambique https://t.co/7EsrmUQpxQ",,,curious / curioso,Instagram,pt,1083467163250380800
LucianoHuck,2019-01-09T21:43:11Z,Uma boa notícia sempre vai bem. Parabens a ambos!!!! 👏🏻👏🏻👏🏻 https://t.co/54Au8HE5M0,,,curious / curioso,Twitter for iPhone,pt,1083117003412590592
LucianoHuck,2019-01-08T22:05:06Z,"O jogo. E o time. Futebol, linguagem universal, que conecta em qq lugar do mundo. #nossosmeninos #dandovalor em Vilankulo, Inhambane, Mozambique https://t.co/p2quDz0ZWU",,,curious / curioso,Instagram,pt,1082760130767261696
LucianoHuck,2019-01-08T21:52:38Z,Acabou de publicar uma foto https://t.co/dEjdjJ39LG,,,curious / curioso,Instagram,pt,1082756994119991296
LucianoHuck,2019-01-08T18:03:40Z,"O projeto de lei arrastava-se e foi preciso perdermos um relevante museu - Museu Nacional do Rio de Janeiro - para que a lei avançasse. Agora a sociedade civil, tem mais um bom caminho p/ dar eficiência e fomentar a cultura de doação no Brasil.",,,curious / curioso,Twitter for iPhone,pt,1082699372964597761
LucianoHuck,2019-01-08T18:01:35Z,https://t.co/QXrtDSy4Qy,,,curious / curioso,Twitter for iPhone,,1082698849645486081
LucianoHuck,2019-01-08T17:48:13Z,"Boa iniciativa presidente @jairbolsonaro Os “endowments” são a resposta p/ a longevidade saudável de universidades, museus, ações sociais, fomento à ciência e etc. Qq ação onde o interesse público é relevante mas q não consegue se viabilizar ou auto-financiar pode se beneficiar.",,,curious / curioso,Twitter for iPhone,pt,1082695483825504256
LucianoHuck,2019-01-08T00:19:24Z,Moçambique. Já estava com saudades. Lugar especial. https://t.co/dtJJP3cXN1,,,curious / curioso,Instagram,pt,1082431538816372736
LucianoHuck,2019-01-06T10:15:12Z,Dobrando o Cabo da Boa Esperança. A história de todos nós passa por aqui. ;) #ferias #dandovalor em Cape of Good Hope SPCA https://t.co/0z6C3yPneK,,,curious / curioso,Instagram,pt,1081856701408505861
LucianoHuck,2019-01-05T20:51:13Z,E o 3° lugar? #caldeiraodeouro https://t.co/r6xi2lBPNk,,,curious / curioso,Instagram,pt,1081654374374522880
LucianoHuck,2019-01-05T20:49:53Z,Segue ai @raqueiroga....e o 6° lugar? https://t.co/EYsguprHPz,,,curious / curioso,Instagram,pt,1081654036913303552
LucianoHuck,2019-01-05T20:48:33Z,E vamos lá....começando pelo 10° lugar. 😎 https://t.co/tBbS5ELeyN,,,curious / curioso,Instagram,pt,1081653701490737153
LucianoHuck,2019-01-05T20:46:12Z,"👏🏻👏🏻👏🏻👏🏻👏🏻👏🏻👏🏻 @raqueiroga arrebentou!!!!
Disse tudo!!! Incrivel!!!!
Obrigado @julianapaes Obrigado @mariruybarbosa 
Obrigado a todos os artistas que nos prestigiaram no #caldeiraodeouro… https://t.co/ntHmezDRup",,,curious / curioso,Instagram,pt,1081653111310163969
LucianoHuck,2019-01-05T07:26:17Z,É hoje no caldeiraodohuck. Minhas queridas amigas @julianapaes &amp; @mariruybarbosa apresentam comigo nosso #caldeiraodeouro; as 10 músicas mais queridas do ano que passou. ;) em Estúdios Globo https://t.co/etkygKv7sm,,,curious / curioso,Instagram,pt,1081451806440460288
LucianoHuck,2019-01-04T20:13:17Z,"E lá vamos nós, de novo....como postei dias atrás, antes do dilema do “azul ou rosa”, torço a favor do governo @jairbolsonaro, pq torço a favor do Brasil e respeito a democracia. E acho… https://t.co/Lajalte1oz",,,curious / curioso,Instagram,pt,1081282438091948032
LucianoHuck,2019-01-04T16:27:02Z,E neste sábado tem o #CaldeiraodeOuro. As 10 músicas mas tocadas no playlist do caldeiraodohuck em 2018 irão embalar o nosso palco. Espero todos vcs. @IzaReal só para dar um gostinho do… https://t.co/UlWPROcSFp,,,curious / curioso,Instagram,pt,1081225499966353411
LucianoHuck,2019-01-03T19:04:40Z,Rosa ou azul? 🤔 Tanto faz. https://t.co/M3X6W1zZER,,,curious / curioso,Instagram,pt,1080902784961204225
LucianoHuck,2019-01-01T19:57:56Z,Desejo sorte ao Presidente  @jairbolsonaro. Q Deus ilumine seu caminho. Q o senhor seja de fato um Presidente p/ todos. Q nos ajude a unir o país. E trabalhe incansavelmente para que o Brasil seja um país menos desigual no futuro.,,,curious / curioso,Twitter for iPhone,pt,1080191411864158209
LucianoHuck,2018-12-31T23:42:37Z,"Que o ano novo seja cheio de saúde, paz, amor e diálogo. Dialogando resolvemos qq obstáculo, diferença, conflito. Dialogando achamos caminhos onde podemos caminhar juntos e na mesma… https://t.co/DCCGTxlyEo",,,curious / curioso,Instagram,pt,1079885569658966016
LucianoHuck,2018-12-30T22:03:35Z,Excelente artigo do Paulo Hartung na Crusoé: https://t.co/ZzGZCgwXQx,,,curious / curioso,Twitter for iPhone,pt,1079498260102795264
LucianoHuck,2018-12-25T00:20:33Z,Feliz natal! Uma noite de paz e amor! São os votos da familia Ksyvickis Huck! Hohoho...🎄 https://t.co/xnInrsgNq4,,,curious / curioso,Instagram,pt,1077358398671388678
LucianoHuck,2018-12-24T18:28:46Z,"Desejamos a todos um Feliz Natal!Com as boas energias das aguas de uma cachoeira que nos traz paz, renovação, pureza e vida.    🎄🙏🏻 https://t.co/rS6bX0SD6a",,,curious / curioso,Instagram,pt,1077269868964134917
LucianoHuck,2018-12-24T14:30:24Z,"Abraços falam direto ao coração! Literalmente! Talvez você não saiba, mas um bom abraço pode diminuir o estresse, regular a pressão arterial e até aumentar níveis de hormônios responsáveis… https://t.co/kt6s2rIfzW",,,curious / curioso,Instagram,pt,1077209884201009153
LucianoHuck,2018-12-23T13:16:06Z,"Todo meu amor materializado em uma imagem rara. Juntos para a revista elaoglobo do @jornaloglobo. Celebrando a inteligência, beleza, equilíbrio, maternidade, maturidade e aprendizados de… https://t.co/Hb3tjBeKzl",,,curious / curioso,Instagram,pt,1076828798165778432
LucianoHuck,2018-12-22T21:54:22Z,"Moçambique foi uma experiência inesquecível.
Por vários motivos, mas o principal deles, reforça mais uma vez tudo o que vem me incomodando a tempos, o mundo esta cada vez mais desigual. As… https://t.co/4nHkNj7hX4",,,curious / curioso,Instagram,pt,1076596834234257408
LucianoHuck,2018-12-22T02:57:06Z,Let’s foil. Melhor brinquedo dos últimos tempos. 🤙🏻 #ferias #esporte liftfoils https://t.co/nvoJX6hzBo,,,curious / curioso,Instagram,pt,1076310633073819648
LucianoHuck,2018-12-21T23:08:42Z,"Toda criança tem que poder brincar. Por isso, acredito muito nesta “tecnologia social” que o Alison &amp; Ana Paula desenvolveram. No caldeiraodohuck vcs vão entender direito. É lindo.… https://t.co/98ljx8Zhx7",,,curious / curioso,Instagram,pt,1076253155673952256
LucianoHuck,2018-12-21T23:05:02Z,É neste sábado no caldeiraodohuck. Nosso presente de natal para vc que me acompanha o ano todo. Espero que gostem. Fizemos com muito amor.  ❤️🎄 em Santana do Paraíso https://t.co/RH6WDJuWsV,,,curious / curioso,Instagram,pt,1076252233145217026
LucianoHuck,2018-12-19T20:25:46Z,Banho e Tosa. #mode #ferias https://t.co/Fj5THUKDhJ,,,curious / curioso,Instagram,pt,1075487375051157504
LucianoHuck,2018-12-18T00:43:37Z,"Que mega orgulho!!!! Parabéns @gabriel1medina!!! Mais do que merecido!!! Talento, foco, determinação, muito treino, fé, amor, família, amigos, sorte...tudo junto e misturado. 🙏🏻🏆🏄🏼‍♂️ wsl… https://t.co/7J0p0hAZ8E",,,curious / curioso,Instagram,pt,1074827491120951297
LucianoHuck,2018-12-15T20:52:15Z,"Adorei. Obrigado pela confiança querida @giseleofficial. Na vida vamos construindo memórias, e as boas, qdo as reencontramos é como se o tempo não tivesse passado. caldeiraodohuck https://t.co/gyIGciXV4F",,,curious / curioso,Instagram,pt,1074044489814167554
LucianoHuck,2018-12-14T17:09:25Z,E ligamos nossa máquina do tempo do caldeiraodohuck para @giseleofficial. É neste sábado. Ficou demais. Espero todos vcs. Obrigado pela confiança querida amiga @giseleofficial. https://t.co/GSDfHHK5SE,,,curious / curioso,Instagram,pt,1073626024305397760
LucianoHuck,2018-12-13T19:17:28Z,"Valeu Araranguá, Criciuma, Sangão, Arroio do Silva e toda região sul de SC. Não sei como agradecer todo o carinho. Espero pode retribuir a altura. E promessa, é dívida; hj pela manhã… https://t.co/Yv8BWCFr5Y",,,curious / curioso,Instagram,pt,1073295861671698432
LucianoHuck,2018-12-12T02:01:33Z,Obrigado minhas queridas amigas @julianapaes &amp; @mariruybarbosa. Sempre mega hiper bem vindas. 😘 caldeiraodohuck #caldeiraodeouro em Estúdios Globo https://t.co/fKQD6KPgd2,,,curious / curioso,Instagram,pt,1072672776501235712
LucianoHuck,2018-12-11T09:29:03Z,"A eleição ja acabou, e tem gente que segue querendo que o país fique dividido. A hora é de diálogo. Para quem ouviu o galo cantar, mas não sabe onde, e ja sai atirando pedras na web, esta… https://t.co/qFU5x0ZhXS",,,curious / curioso,Instagram,pt,1072423005035397123
LucianoHuck,2018-12-11T01:25:48Z,"Hj foi um dia especial. Eu &amp; @JRart na lua. Ela esta cravada no ponto mais alto do Morro da Providência, a primeira favela do Brasil. Faz parte da Casa Amarela. Belíssimo projeto social… https://t.co/xsntW3C38x",,,curious / curioso,Instagram,pt,1072301389278273536
LucianoHuck,2018-12-08T20:59:25Z,Não medimos esforços por um abraço. E eu adoro contar estas histórias.                                Maria Alice &amp; Antonio; que juntos vcs possam escrever novos e lindos capítulos da… https://t.co/WNfXsTMYWq,,,curious / curioso,Instagram,pt,1071509577663987713
LucianoHuck,2018-12-07T11:38:41Z,"E neste sábado tem um #EncontrarAlguem muito, muito, muito bacana no caldeiraodohuck. Uma filha que batalhou por mais de 30 anos por um abraço do pai. Ficou demais. Espero todos vcs.… https://t.co/wgBikO6OIR",,,curious / curioso,Instagram,pt,1071006073895686144
LucianoHuck,2018-12-06T22:52:02Z,A caminho.... https://t.co/0J9qXlxwjK,,,curious / curioso,Instagram,pt,1070813140475092992
LucianoHuck,2018-12-06T20:31:16Z,"Neste natal vamos presentear quem a gente gosta com....LIVROS.
Temos que fortalecer o universo das letras; editoras, livrarias, livreiros.
O setor esta sofrendo, e se ele minguar, míngua… https://t.co/GIsKvP3Ud9",,,curious / curioso,Instagram,pt,1070777717170278400
LucianoHuck,2018-12-04T22:16:39Z,Chocado. É muita crueldade. 😢 https://t.co/BkBl1eDDTA,,,curious / curioso,Instagram,pt,1070079463092838400
LucianoHuck,2018-12-04T01:58:56Z,"Valeu pelo convite @joaovicente27 @fabioporchat @emicida chico.bosco. Adorei o papo. #papodesegunda #gnt em São Paulo, Brazil https://t.co/uyzLMlIP97",,,curious / curioso,Instagram,pt,1069773013502042113
LucianoHuck,2018-12-02T17:54:46Z,"Se puderem dar uma moral na votação do Troféu UOL de TV 2018, a turma aqui de casa agradece...😬 ai vai o link: https://t.co/zHH14sEwPy",,,curious / curioso,Twitter for iPhone,pt,1069288779826020353
LucianoHuck,2018-12-02T12:12:14Z,"Obrigado a todos que estivem com a gente se emocionado e divertindo com o #latavelha deste sábado, para quem não viu ai vai o link:  https://t.co/6wo1XnyKYF caldeiraodohuck https://t.co/wtOPy4wiGf",,,curious / curioso,Instagram,pt,1069202577907220481
LucianoHuck,2018-11-30T15:40:20Z,E amanhã tem #latavelha no caldeiraodohuck. Espero todas vocês. Ficou muito divertido e emocionante. Imperdível. Espero vcs. em Brumadinho MG - A Nossa Cidade https://t.co/pFf3t5Ms2p,,,curious / curioso,Instagram,pt,1068530173283377154
LucianoHuck,2018-11-30T12:31:13Z,"Hoje é o dia dela; o amor da minha vida, mulher, esposa, parceira, mãe, gente fina, divertida, inteligente, linda de doer, talentosa, gata, gostosa, sensível, amiga...
Fui ao dicionário… https://t.co/i0JvqSgrHO",,,curious / curioso,Instagram,pt,1068482580301922304
LucianoHuck,2018-11-27T22:41:56Z,"Ganhamos reforços. Olhar altivo, pensamentos nobres. ;) em Chinhacanine, Gaza, Mozambique https://t.co/jGYAxuhbMk",,,curious / curioso,Instagram,pt,1067549108305563650
LucianoHuck,2018-11-27T21:13:48Z,"Uma boa gargalhada não tem preço. Ainda mais vindo de crianças que tem tão pouco, para não dizer, nada. Em uma região dizimada pela AIDS nas últimas décadas, que fez nascer uma geração de… https://t.co/vqBeqF4d7M",,,curious / curioso,Instagram,pt,1067526931447537667
LucianoHuck,2018-11-26T10:39:26Z,Tenho o maior orgulho de fazer parte desta história. E são histórias como a do Pinguim que fazem do @maderobrasil este lugar tão querido e desejado. 👊🏻🙏🏻🍔 https://t.co/KoPNARFkOm,,,curious / curioso,Instagram,pt,1067004897730678784
LucianoHuck,2018-11-24T19:16:54Z,Será que gentilmente vcs podem me dar uma força? Votação de Melhor Apresentador no UOL. 😬 https://t.co/zHH14sEwPy,,,curious / curioso,Twitter for iPhone,pt,1066410346624311297
LucianoHuck,2018-11-24T03:46:05Z,"A locomotiva. Na única linha férrea de passageiros no Brasil; Belo Horizonte / Vitória. O mundo gira e a gente roda. ;)
caldeiraodohuck #umportodosetodosporum em Ipatinga https://t.co/oFKrHrkJrX",,,curious / curioso,Instagram,pt,1066176098973700096
LucianoHuck,2018-11-23T11:16:51Z,Neste sábado vamos ligar a máquina do tempo do caldeiraodohuck com @maiaraemaraisa. Ficou lindo demais. Que história de vida legal. #visitandoopassado https://t.co/kkCBb4DmGK,,,curious / curioso,Instagram,pt,1065927151780794368
LucianoHuck,2018-11-23T02:03:38Z,Formou. @thiaguinhocomth @rafaelzulu @joaovicente27 @SigaRodriguinho @CantorBelo @AlexandreCarlo_ no caldeiraodohuck em Estúdios Globo https://t.co/BqAV7V0BnI,,,curious / curioso,Instagram,pt,1065787929514131460
LucianoHuck,2018-11-20T18:46:22Z,"Ta ai...@mariruybarbosa uma foto minha ainda criança, pelo Dia Mundial da Criança #worldschildrensday criado pela unicef. Tenho enorme respeito pela instituição e suas iniciativas pelo… https://t.co/S0oO8bcXDE",,,curious / curioso,Instagram,pt,1064953114271322118
LucianoHuck,2018-11-20T01:14:01Z,"Os dias foram inspiradores....Excelentes diálogos sobre inovação e futuro do Brasil, organizados pela @fundacaolemann em parceria com @stanford. #fellows #martincarnoy #dougready… https://t.co/xZlb1b4Of4",,,curious / curioso,Instagram,pt,1064688278727741440
LucianoHuck,2018-11-19T00:27:36Z,"Canadá. Que país lindo, e muito muito muito civilizado. Uma boa referência para o mundo. 🇨🇦 em Golden Ears Provincial Park https://t.co/rzTASOhEoJ",,,curious / curioso,Instagram,pt,1064314212460183554
LucianoHuck,2018-11-17T21:47:42Z,"Meninas, que maravilha a historia de vcs; talento, resiliência, força de vontade, bom humor, criatividade e muita vontade de dar certo. Empreendedoras para valer. Desejo que a vida sorria… https://t.co/IUdCS0pp2m",,,curious / curioso,Instagram,pt,1063911583104012288
LucianoHuck,2018-11-17T05:30:56Z,"Qdo vc sai do elevador e realiza que seu filho mais velho esta crescendo. Alcançou a mãe. 😊❤️ Joaquim &amp; Angelica em Palo Alto, California https://t.co/vYsu1EDAsG",,,curious / curioso,Instagram,pt,1063665769484042240
LucianoHuck,2018-11-12T15:43:30Z,"Sempre bem vinda querida @giseleofficial.
Ficou muito legal. Em breve no caldeiraodohuck. 🙏🏻 em São Paulo, Brazil https://t.co/x2PLdQzeSQ",,,curious / curioso,Instagram,pt,1062007989870252033
LucianoHuck,2018-11-10T21:36:52Z,E para quem não assistiu...ai vai o link: https://t.co/6Roh1PTXgW,,,curious / curioso,Twitter for iPhone,pt,1061372141986308096
LucianoHuck,2018-11-10T21:35:23Z,"Rafa, um prazer poder contar a sua história no caldeiraodohuck. Seu talento  é indiscutível. Agora é estudar muito e lapidar este dom. Que a vida lhe sorria sempre. E nunca mais deixe que… https://t.co/Rqug7N5wN1",,,curious / curioso,Instagram,pt,1061371768454160387
LucianoHuck,2018-11-04T17:11:47Z,"P/quem não assistiu ontem no @caldeiraodohuck, recomendo; uma das histórias mais legais que já contamos.  https://t.co/nJw6kZtKFO",,,curious / curioso,Twitter for iPhone,pt,1059131104727306242
LucianoHuck,2018-11-03T22:00:49Z,"Jô, Que Deus abençoe vc e toda a sua família. Que vcs sigam com este lindo projeto, tenho certeza que hj vcs fizeram, e eu me incluo, muita gente refletir sobre suas próprias vidas. Pensar… https://t.co/hOqubhXMtg",,,curious / curioso,Instagram,pt,1058841453420535809
LucianoHuck,2018-11-03T12:10:53Z,"Pense em alguém gente boa, amoroso, inteligente, bom de papo, capaz de fazer amigos, carinhoso que só ele, companheiro para qq parada, curioso como nunca vi, onde a coragem e a cautela… https://t.co/5Ywms2efX5",,,curious / curioso,Instagram,pt,1058692992662470661
LucianoHuck,2018-11-02T17:22:55Z,"Como é bom qdo uma ideia maluca, sai do papel e vira realidade. É neste sábado no caldeiraodohuck. Parabens luigicani, vc é incrível. Meses de produção, centenas de profissionais… https://t.co/gWKKpkr0gt",,,curious / curioso,Instagram,pt,1058409131663675392
LucianoHuck,2018-11-02T02:13:20Z,"Partindo da premissa de apoiar as agendas positivas a favor do país e das boas práticas, vigilante sempre e crítico qdo necessário; vejo c/ bons olhos Sergio Moro como Ministro da Justiça. Mais um passo importante na moralização do sistema e combate ao crime organizado.",,,curious / curioso,Twitter for iPhone,pt,1058180224888778752
LucianoHuck,2018-10-30T11:50:35Z,"14 anos de muito amor, felicidade, frutos, cumplicidade, parceria, amizade, sonhos, realizações, aprendizado, gratidão, obstáculos superados e boas gargalhadas. ❤️ #30/10… https://t.co/Y5X6GnbUXg",,,curious / curioso,Instagram,pt,1057238330050596864
LucianoHuck,2018-10-27T15:24:21Z,"Não vetei nada. Não me colocaria neste papel no @agora_movimento, respeito a diversidade do grupo. Não me sinto representado nesta eleição presidencial. Vms olhar p/ frente, pensar no país que gostariamos de viver. Independentemente de quem vencer, seremos a resistência positiva. https://t.co/hIKl6emZwc",,,curious / curioso,Twitter for iPhone,pt,1056204963930669058
LucianoHuck,2018-10-25T23:38:04Z,este sorriso é meu combustível....❤️       linda foto @pinogomes @celso_kamura &amp; @angelicaksy https://t.co/vseRmVjVEN,,,curious / curioso,Instagram,pt,1055604435542593536
LucianoHuck,2018-10-25T22:34:00Z,mais uma vez... https://t.co/6XwTs3wxRL,,,curious / curioso,Instagram,pt,1055588315334918145
LucianoHuck,2018-10-24T00:20:57Z,Hoje é a celebração do Dia do Aviador e da Força Aérea Brasileira. Juntei imagens de momentos muito especiais que vivi a bordo de aeronaves de combate da fab_oficial. Tenho profundo… https://t.co/m25ogJyBcO,,,curious / curioso,Instagram,pt,1054890454309847040
LucianoHuck,2018-10-20T22:11:19Z,"Aos gestores e professores da Escola Municipal de Educação Básica Professora Hebe de Almeida Leite Cardoso, em Novo Horizonte (SP); vcs são incríveis. Que trabalho belíssimo de resgate da… https://t.co/8pA6c6fDzD",,,curious / curioso,Instagram,pt,1053770666992955392
LucianoHuck,2018-10-17T19:55:22Z,Caleidoscópio. Hoje tive o prazer de conhecer Inhotim. Uma das iniciativas de arte &amp; cultura mais legais que já vi no mundo. Vale o passeio. Vale a visita. 👏🏻 em Instituto Museu Inhotim MG https://t.co/bPQ1QMsgg7,,,curious / curioso,Instagram,pt,1052649290630385664
LucianoHuck,2018-10-17T02:06:34Z,Artigo na íntegra. renovabr @agora_movimento #juntospelarenovação https://t.co/Tr7RWaw2uS,,,curious / curioso,Instagram,es,1052380318970318848
LucianoHuck,2018-10-17T02:02:34Z,Artigo na íntegra. https://t.co/RVdPe6OnPP,,,curious / curioso,Instagram,pt,1052379311431405568
LucianoHuck,2018-10-16T21:14:13Z,"A quem interessar, a íntegra do artigo esta no meu facebook: https://t.co/5I3D0RmHXx ou no site da Folha;… https://t.co/W2jFKLJdOu",,,curious / curioso,Instagram,pt,1052306743848460288
LucianoHuck,2018-10-16T17:25:55Z,"Qdo a gente acorda, e o “contador” do Facebook vira um numero redondo e relevante como este. Uma “comunidade do bem” com 18.000.000 de pessoas. Milhares  com uma visão de mundo parecida, remando na mesma direção. Muito obrigado pela confiança e carinho de sempre. 🙏🏻 https://t.co/UpdqbLT2Wu",,,curious / curioso,Facebook,pt,1052249292113629184
LucianoHuck,2018-10-16T15:11:32Z,"Qdo a gente acorda, e o “contador” do Facebook vira um numero redondo e relevante como este. Uma comunidade do bem com 18.000.000 de pessoas. Milhares de pessoas com uma visão de mundo… https://t.co/858r60qQrw",,,curious / curioso,Instagram,pt,1052215473855709185
LucianoHuck,2018-10-14T01:33:15Z,"Rafa, feliz dia das crianças!!!! Foi demais poder fazer parte do seu sonho. E ajudar a se materializar. Foi um Lata Velha muito especial. Curta seu opala, mas mais importante que isso,… https://t.co/vUbUQBGVDs",,,curious / curioso,Instagram,pt,1051284768405499904
LucianoHuck,2018-10-12T15:26:23Z,Eu. No século passado. rs 😊 #felizdiadascriancas https://t.co/hFbXhoX3kQ,,,curious / curioso,Instagram,pt,1050769657278472193
LucianoHuck,2018-10-12T15:19:39Z,"Feliz dia das crianças! Hoje é dia de compartilhar amor e carinho! Hoje é dia de pensar no futuro! Hoje é dia celebrar as próximas gerações! Hoje é dia de refletir que nós; como pais,… https://t.co/lRMAsyszCD",,,curious / curioso,Instagram,pt,1050767962330816517
LucianoHuck,2018-10-09T01:09:37Z,Muito orgulhoso de todo processo desafiador do renovabr; do nascimento da ideia á eleição de 16 lideranças. Ciclo virtuoso e relevante. Boas sementes da verdadeira renovação política estão… https://t.co/sHc3ApeaEM,,,curious / curioso,Instagram,pt,1049466882019987456
LucianoHuck,2018-10-09T01:06:37Z,"Também orgulhoso de fazer parte deste movimento. Desta agenda inteligente e positiva. Parabens @agora_movimento #Repost @agora_movimento with get_repost
・・・
Começamos a semana com boa… https://t.co/8Zw7hJ3e3p",,,curious / curioso,Instagram,pt,1049466126227378183
LucianoHuck,2018-10-09T01:01:56Z,Muito orgulhoso de todo processo desafiador do renovabr; do nascimento da ideia á eleição de 16 lideranças. Ciclo virtuoso e relevante. Boas sementes da verdadeira renovação política estão… https://t.co/bIThRBS6dm,,,curious / curioso,Instagram,pt,1049464949771259905
LucianoHuck,2018-10-06T22:18:41Z,"Professora Maria Antonia, pode parecer que quem ganhou algo hoje foi a senhora. Mas garanto que nós - eu &amp; todos que assistiram a sua história - ganhamos muito mais. Parabéns pela… https://t.co/BHxvQ5eLGh",,,curious / curioso,Instagram,pt,1048699089112748032
LucianoHuck,2018-10-06T19:09:15Z,"Chegamos na reta final da eleição! Ainda está com dúvida sobre seus candidatos a Deputado ou Senador? Confere no https://t.co/2HgsH5cxqz
Dá até pra fazer a colinha digital!!",,,curious / curioso,Twitter for iPhone,pt,1048651418582900737
LucianoHuck,2018-10-05T15:26:52Z,Ainda não sabe em quem votar para deputados e senadores? Acesse; https://t.co/CCs7qeDGxX e ache um candidato que pense como vc.,,,curious / curioso,Twitter for iPhone,pt,1048233064437047297
LucianoHuck,2018-10-05T15:25:57Z,https://t.co/CCs7qeDGxX https://t.co/DbarjMtr2e,,,curious / curioso,Twitter for iPhone,,1048232835688087552
LucianoHuck,2018-10-04T17:28:44Z,"Qdo a gente ama mais do que a nós mesmos! Orgulhoso demais!  ❤️           #Repost @angelicaksy with get_repost
・・・
Comemorando hoje 30 anos do nosso #VoudeTaxi🙏 , esse taxi me levou para… https://t.co/2MuYoECSpr",,,curious / curioso,Instagram,pt,1047901347373359104
