screen_name,created_at,text,in_reply_to_screen_name,retweeted_status_screen_name,user_description,source,lang,id
LucianoHuck,2021-04-19T12:25:08Z,"Hj é dia de refletir sobre a importância dos nossos povos tradicionais. A pandemia pôs em risco etnias q estão nos primórdios da nossa identidade. A riqueza cultural do BR nos fortalece. Precisamos saber ouvir e tratar nossos indígenas c/ respeito, cuidado e carinho. https://t.co/kx7cnrRAoZ",,,curious / curioso,Twitter for iPhone,pt,1384120880352034819
LucianoHuck,2021-04-16T16:55:05Z,"Nossos desafios como nação são enormes. As consequências da atual gestão desastrosa de combate à Covid19 vão se alongar por gerações. O q torna ainda + urgente um projeto de país realista e factível, q não brinque com a esperança das pessoas e nem manipule o cidadão com mentiras. https://t.co/qrY4X1AwPy",,,curious / curioso,Twitter for iPhone,pt,1383101651125420045
LucianoHuck,2021-04-12T23:33:56Z,"“Novinha” é um dos termos mais procurados em sites pornográficos. O Brasil é um dos países com maior taxa de gravidez entre adolescentes no continente. Pra encontrar uma solução, só há um caminho: precisamos falar sobre isso. https://t.co/KRBlK1GeIN",,,curious / curioso,Twitter for iPhone,pt,1381752474206412803
LucianoHuck,2021-04-11T15:01:24Z,"O Terceiro Setor é uma poderosa encubadora de políticas públicas. Sem ONGs, centrais de favelas, movimentos indígenas, articulações empresarias filantrópicas, a fome na pandemia estaria bem maior. Por respeito ao Terceiro Setor, recomendo a leitura do manifesto de hoje na @folha. https://t.co/6ZR9Vcqql9",,,curious / curioso,Twitter for iPhone,pt,1381261104026894336
LucianoHuck,2021-04-10T21:23:51Z,"@Fcxthay por favor mande um carinhoso bj a sua bisa. Adoraria encontra-la, estou com uma saudade dos abraços que vc nem imagina. Em breve e com a vacina eles vão voltar. Feliz aniversário. Saúde saúde e mais saúde para ela. ❤️🎂 https://t.co/kPSdPNmpHt",Fcxthay,,curious / curioso,Twitter for iPhone,pt,1380994960992915457
LucianoHuck,2021-04-10T18:44:06Z,Acabou de publicar uma foto https://t.co/iAIfpnglV6,,,curious / curioso,Instagram,pt,1380954760849678336
LucianoHuck,2021-04-10T17:06:12Z,O padrão mais tradicional pra aferir o crescimento de um país ainda é o PIB. Mas este conceito não expressa o desenvolvimento sustentável e o bem-estar social que moldam a realidade do século 21. Taí um debate atualíssimo. Recomendo ler coluna de Carlos Góes no @JornalOGlobo hj. https://t.co/Vr2BhsfCIa,,,curious / curioso,Twitter for iPhone,pt,1380930123495575560
LucianoHuck,2021-04-09T21:45:53Z,"Concordo em gênero, número e grau. https://t.co/OANWJLO9MT",,,curious / curioso,Twitter for iPhone,pt,1380638121432383500
LucianoHuck,2021-04-09T00:44:59Z,Só para ver se eu entendi; a ideia é zerar as taxas de importação de armas e aumentar a taxa sobre LIVROS? E isso durante a maior crise do sistema educacional que já enfrentamos. Realmente as prioridades estão completamente invertidas. https://t.co/VQIDQM5Mmz,,,curious / curioso,Twitter for iPhone,pt,1380320803527475200
LucianoHuck,2021-04-08T19:39:19Z,"Erra quem liga desmatamento a desenvolvimento. O Índice de Progresso Social de 600 cidades da Amazônia está abaixo da média brasileira. Pra mudar isto, empresas e ONGs cobram arrojo do governo, que faz gestão desastrosa no meio ambiente. Produção aliada à preservação é solução. https://t.co/Cw2xxuTZwV",,,curious / curioso,Twitter for iPhone,pt,1380243882437451776
LucianoHuck,2021-04-07T12:55:31Z,Eu vou tomar a vacina quando chegar a minha vez no SUS. #diganãoàfiladupla,,,curious / curioso,Twitter for iPhone,pt,1379779872336252931
LucianoHuck,2021-04-07T12:42:14Z,Temos td p/ ser a maior Potência Produtiva e Verde do Planeta. Um modelo p/ Pagamento por Serviços Ambientais(PSA) q incentive o produtor a não desmatar é um passo importante. Um projeto piloto começa agora no MA. O PSA Soja Brasil vai valorizar quem preserva. No @valoreconomico https://t.co/kNXcT21Zhu,,,curious / curioso,Twitter for iPhone,pt,1379776529622777862
LucianoHuck,2021-04-07T02:57:24Z,Tiago Leifert mandou muito bem. 👏🏻👏🏻👏🏻👏🏻👏🏻 #BBB21,,,curious / curioso,Twitter for iPhone,pt,1379629352053317633
LucianoHuck,2021-04-06T23:23:01Z,"O Brasil sempre foi campeão mundial de vacinação. Mas nesta pandemia, estamos tomando mais um 7 X 1. É vexame, é incompetência e é também desumanidade.  https://t.co/A4LigO5vR7",,,curious / curioso,Twitter for iPhone,pt,1379575400687370240
LucianoHuck,2021-04-06T22:50:37Z,E ai? Vms seguir politizando e judicializando? #vacinaja https://t.co/FZrgwDhkt6,,,curious / curioso,Twitter for iPhone,pt,1379567247992180737
LucianoHuck,2021-04-06T20:53:56Z,Tem meu total apoio @IlonaSzaboC https://t.co/7MYZOpYH1e,,,curious / curioso,Twitter for iPhone,pt,1379537881568579587
LucianoHuck,2021-04-06T18:47:55Z,"A Nova Zelândia inspira um futuro melhor. A Nação de 5 milhões de habitantes é um caso raro. Em 30/05, só 2 casos de Covid registrados lá. Receita pra vencer a pandemia: 1.respeito à ciência; 2.socorro à população; e 3.exemplo: a primeira ministra cortou o próprio salário em 20%. https://t.co/PZMdHFdjS3",,,curious / curioso,Twitter for iPhone,pt,1379506168272457734
LucianoHuck,2021-04-06T16:37:32Z,Quando vc é filho de professores e um ex-aluno - que transformou os aprendizados em uma carreira sólida e de sucesso - tece elogios ao mestre. È motivo de muito orgulho. ☺️  https://t.co/Q8crnemVGM,,,curious / curioso,Twitter for iPhone,pt,1379473358211932160
LucianoHuck,2021-04-06T13:03:39Z,"O BR tem td p/ ser a maior Potência Verde do planeta, uma nação agroindustrial sustentável, lider em descarbonização. P/ tanto, precisamos mudar de direção. No momento, estamos + p/ pária do q p/ líder global. Recomendo o artigo de @PauloHartungES no @Estadao. O caminho está lá. https://t.co/HHMtQB1FNn",,,curious / curioso,Twitter for iPhone,pt,1379419532012486656
LucianoHuck,2021-04-06T02:57:59Z,É sobre entender a dor do outro. É sobre sair da inação. É sobre reconhecer vozes diferentes da sua. João e Camila arrebentaram. Aula em rede nacional. #BBB21,,,curious / curioso,Twitter for iPhone,pt,1379267112154324993
LucianoHuck,2021-04-06T01:50:33Z,"A realidade está mais dura do que nunca. Segundo a FGV, o número de brasileiros vivendo na pobreza triplicou. Saltou de 9,5 milhões de pessoas em agosto de 2020 pra 27,3 milhões em março 2021. A sociedade e governo precisam atuar juntos. Senão vamos seguir rumo ao caos social.",,,curious / curioso,Twitter for iPhone,pt,1379250140008091650
LucianoHuck,2021-04-06T00:06:02Z,"A solidariedade precisa ser mais contagiosa que o vírus. Muitas famílias estão passando fome, não podemos não fazer nada. Se puder, faça uma doação e ajude a encher a panela de uma família que esta precisando. https://t.co/HST3pBlY4e https://t.co/nMnnF0RmHV",,,curious / curioso,Twitter for iPhone,pt,1379223838781796356
LucianoHuck,2021-04-04T11:59:48Z,Feliz Páscoa a todos! A data representa libertação na tradição judaica e ressureição entre os cristãos. Liberdade e renascimento são valores fundamentais sempre e ainda mais neste momento em que nós e o Brasil somos testados no limite. Que Deus nos abençoe. 🙏🏻,,,curious / curioso,Twitter for iPhone,pt,1378678688561119233
LucianoHuck,2021-04-03T21:50:52Z,Deixo aqui meu carinho a família e aos fãs de Agnaldo Timoteo. 🙏🏻,,,curious / curioso,Twitter for iPhone,pt,1378465046125240320
LucianoHuck,2021-04-02T21:24:18Z,Números que valem mais que mil palavras. Que tristeza. https://t.co/FvGkTEnrDJ,,,curious / curioso,Twitter for iPhone,pt,1378095975475056642
LucianoHuck,2021-04-01T15:00:58Z,"Vocês viram o navio encalhado nas semana que passou, né?
Então...fiz uma comparação a respeito. Aperta o play e liga o som. https://t.co/5GifyNUkA5",,,curious / curioso,Twitter Media Studio,pt,1377637118235791366
LucianoHuck,2021-03-31T14:51:10Z,"Ditadura nunca mais! Hj e sempre, temos de defender a legalidade dentro do Estado democrático de direito. Democracia é uma obra em constante aperfeiçoamento. A história democrática não tem fim. Rupturas institucionais, como o golpe de 64, são retrocessos inaceitáveis. https://t.co/d73I4P6w70",,,curious / curioso,Twitter for iPhone,pt,1377272260550144008
LucianoHuck,2021-03-30T19:22:58Z,"Respeito muito as Forças Armadas. Dentro de cada farda, uma história pessoal. Histórias que vi, vivi, contei e compatilhei muitas delas. Pra fora dela, o dever de proteger o povo, a pátria e a democracia prevista na Constituição de 1988.",,,curious / curioso,Twitter for iPhone,pt,1376978273750679561
LucianoHuck,2021-03-29T15:49:40Z,"A tecnologia é uma poderosa aliada p/ encurtar o caminho da transformação do Brasil num país + eficiente e afetivo. Governos q não se transformam em plataformas digitais correm o risco de perder o poder de liderar. Por isso, a importância desta agenda avançar de forma concreta. https://t.co/32Hs2L0nL4",,,curious / curioso,Twitter for iPhone,pt,1376562209363521548
LucianoHuck,2021-03-27T20:13:00Z,307 mil mortos. E hj a Covid levou tb a mãe do @pefabiodemelo. Faltavam 4 dias p/ q d.Ana tomasse a segunda dose da vacina. Revolta pensar q ela já devia estar imunizada. O negacionismo e miopia política fez este governo genocida não comprar vacinas qdo o mundo inteiro comprava.,,,curious / curioso,Twitter for iPhone,pt,1375903704168202241
LucianoHuck,2021-03-25T15:24:20Z,"É incrível ver alguém fazendo o que ama. E quando esse alguém é um professor, minha esperança vai lá em cima. 
Esse vídeo do professor Silvio Predis me deu até saudade da escola 😊

Valorizar os professores e lutar pra que eles sejam bem remunerados, eu acredito muuuuuito nisso! https://t.co/ghjoxfPJSs",,,curious / curioso,Twitter Web App,pt,1375106281422385163
LucianoHuck,2021-03-25T12:44:35Z,"“Antes tarde do que nunca” se aplica a muitas situações. Mas não cabe depois de tantas vidas destruídas pelo negacionismo. Só após 300 mil mortes, os responsáveis pela gestão nacional desta crise começam a fazer o básico. Mas nesta altura, o povo quer solução. E solução é vacina.",,,curious / curioso,Twitter for iPhone,pt,1375066079454752780
LucianoHuck,2021-03-25T12:23:02Z,E o paredão entre Juliette e Sarah vem quando? Ansioso por este dia! Em quem vc votaria para sair?,,,curious / curioso,Twitter for iPhone,pt,1375060656697786369
LucianoHuck,2021-03-25T10:49:14Z,"“Estamos percebendo um movimento gde de venda de botijão de gás p/ comprar comida, as pessoas aqui na favela estão voltando a cozinhar c/ querosene e lenha.” WhatsApp de um parceiro q está levando cestas básicas de porta em porta. Estamos a beira de um colapso de saúde e social.",,,curious / curioso,Twitter for iPhone,pt,1375037052174090241
LucianoHuck,2021-03-24T15:22:22Z,"Olhem estas cenas!! Pirei. 

E vc, fez alguma coisa por alguém nesta pandemia? 
Parabéns Romeirik! https://t.co/N40SneSS90",,,curious / curioso,Twitter Media Studio,pt,1374743399027388422
LucianoHuck,2021-03-24T02:07:57Z,Vcs ja viram estas cenas? https://t.co/6J2iVQOHY4,,,curious / curioso,Twitter for iPhone,pt,1374543477728538625
LucianoHuck,2021-03-23T22:16:36Z,"3.251 mortos por Covid registados hoje. Meu Deus. Números de tragédia bíblica. 298.796 famílias ja enterraram alguém amado vítimas do vírus pelo descontrole, despreparo e incompetência na gestão da pandemia. O negacionismo além de burro, é letal.",,,curious / curioso,Twitter for iPhone,pt,1374485257492197380
LucianoHuck,2021-03-22T19:50:57Z,Imagens como estas divulgadas por @eurenesilva precisam ir além da indignação: têm de despertar consciências e promover transformações. https://t.co/ffIcnIdxZZ,,,curious / curioso,Twitter for iPhone,pt,1374086215469826054
LucianoHuck,2021-03-22T02:09:58Z,"Hj em carta aberta, nomes importantes e experientes de áreas diversas apontam como enfrentar a pandemia e acelerar a vacinação. É a sociedade pressionando o negacionismo a seguir a ciência, concentrar na vacina, planejar e executar. Pelo bem de todos, independente das ideologias.",,,curious / curioso,Twitter for iPhone,pt,1373819209122263045
LucianoHuck,2021-03-21T16:14:48Z,"“A dor q não tem rosto doi menos nos q não a sentem
na pele.” “Lavar as mãos com sabonete e manter
distanciamento social não é só para quem quer é para quem pode.” Leitura urgente e necessária o artigo de @pretozeze @edulyragf &amp; @celsoathayde hj na @folha https://t.co/jpDMsjuqtL https://t.co/UX5KuBR6lR",,,curious / curioso,Twitter for iPhone,pt,1373669432455798788
LucianoHuck,2021-03-21T00:04:38Z,Tenho orgulho de poder compartilhar falas como esta em um programa de televisão p/ q tds possam ouvir em alto e bom som. Orgulhoso do nosso time do @caldeiraodohuck q tem a sensibilidade de pesquisar histórias como a do casal Will &amp; Nat e seu poderoso projeto Ateliê Afrocultural. https://t.co/mfcpMStA84,,,curious / curioso,Twitter for iPhone,pt,1373425282099650569
LucianoHuck,2021-03-20T22:05:49Z,Acabou de publicar um vídeo https://t.co/o9cU98CXII,,,curious / curioso,Instagram,pt,1373395379639750656
LucianoHuck,2021-03-20T21:24:43Z,"Aos olhos do mundo, o Brasil sempre foi admirado pela felicidade do povo. Hj causamos é medo. Que tristeza! A CNN dos EUA nos vê como uma ameaça, um país na contramão do progresso com um governo que tripudiou da ciência e da vacina e foi cúmplice do vírus. https://t.co/aweMz5VIwI",,,curious / curioso,Twitter for iPhone,pt,1373385036985217028
LucianoHuck,2021-03-17T16:42:14Z,Eu que agradeço. Ajudar o outro é a melhor forma de ajudar a si mesmo. https://t.co/qLvowR82pm,,,curious / curioso,Twitter for iPhone,pt,1372226784801005568
LucianoHuck,2021-03-16T23:49:29Z,"O negacionismo de jaleco pode ser ainda mais letal que o negacionismo fardado. Pelo bem de todos, esperamos uma mudança radical e enfática da narrativa. Precisamos da ciência, do bom senso e de planejamento. O momento é dramático, crítico, não podemos seguir errando tanto.",,,curious / curioso,Twitter for iPhone,pt,1371971916303630336
LucianoHuck,2021-03-15T21:33:52Z,"Mulher de opinão, competente e reconhecida, doutora Ludhmila Hajjar se orientou pela ética médica pra dizer um sonoro não ao negacionismo. Em saúde, é por meio da ciência que as pessoas são salvas. E por não pensar assim este governo já destruiu + de 278 mil famílias. https://t.co/u2HPX0kkdh",,,curious / curioso,Twitter for iPhone,pt,1371575399587659782
LucianoHuck,2021-03-11T22:45:36Z,Ontem foi dia de levar a sogra pra vacinar! Que alegria 🙌🙏 https://t.co/ACDiEYVx3g,,,curious / curioso,Twitter for iPhone,pt,1370143902238400512
LucianoHuck,2021-03-11T21:45:32Z,"O governante que é contra máscaras, vacinas, promove aglomerações e zomba das vítimas tem responsabilidade direta sobre a tragédia em curso no país. #CPIdaPandemiaJá 
https://t.co/coF3ls1ZnC",,,curious / curioso,Twitter for iPhone,pt,1370128782519115781
LucianoHuck,2021-03-11T16:11:16Z,"O Brasil tem tudo p/ liderar agendas globais, principalmente se apontarmos o país como principal referência agroindustrial sustentável do planeta. Podemos nos tornar uma potência verde global, apesar do atual negacionismo que nos trava. Escrevo sobre isto no @FinancialTimes hj. https://t.co/wvx0NGg4Rc",,,curious / curioso,Twitter for iPhone,pt,1370044664255021056
LucianoHuck,2021-03-08T19:51:38Z,"No Brasil, o futuro é duvidoso e o passado é incerto. Na democracia, a Corte Suprema tem a última palavra na Justiça. É respeitar a decisão do STF e refletir com equilíbrio sobre o momento e o que vem pela frente. Mas uma coisa é fato: figurinha repetida não completa álbum.",,,curious / curioso,Twitter for iPhone,pt,1369012955925389318
LucianoHuck,2021-03-08T12:37:34Z,"Dia Internacional da Mulher por Angélica.

Entender o passado é o melhor jeito de construir o futuro. #diainternacionaldamulher https://t.co/7XUtKn7cyj",,,curious / curioso,Twitter Media Studio,pt,1368903719941726210
LucianoHuck,2021-03-08T00:25:46Z,Acabou de publicar uma foto https://t.co/4z2Pe9r06C,,,curious / curioso,Instagram,pt,1368719555191836677
LucianoHuck,2021-03-08T00:15:23Z,"Pra Geraldo Samor do @BrazilJournal, só há uma coisa pior do que um idiota com iniciativa. É um idiota com iniciativa que precisa lidar com uma pandemia. Recomendo ler este editorial realista. https://t.co/yLTv5BOEbz",,,curious / curioso,Twitter for iPhone,pt,1368716942400499713
LucianoHuck,2021-03-07T23:47:42Z,"Em Siriri, interior de Sergipe, a equipe do Programa de Imunização foi duas vezes à casa de dona Maria para vaciná-la, mas não a encontrou. Os profissionais, então, foram até a beira do rio onde ela lava roupa para aplicar a primeira dose. Busca ativa!  VIVA O SUS! / via @glaucow https://t.co/X2qzu67sgC",,,curious / curioso,Twitter for iPhone,pt,1368709977414664196
LucianoHuck,2021-03-06T16:13:38Z,"Para a maioria do povo ja está sobrando mês no final do salário, auxílio, reservas, poupança. Ir ao supermercado, comprar gás, pagar a luz, abastecer o carro: tudo isso virou um tormento. Os preços estão nas alturas.  Menos chilique, mais governo.",,,curious / curioso,Twitter for iPhone,pt,1368233319083749379
LucianoHuck,2021-03-04T21:10:58Z,"P/ quem quiser acompanhar a apresentação de resultados do @RenovaBR. P/ quem acredita na necessária renovação política, p/ quem acredita que precisamos subir o sarrafo da ética independente de ideologias, clic no link: https://t.co/KyeawaGT3F https://t.co/MnvIfVD8eq",,,curious / curioso,Twitter for iPhone,pt,1367583368901189637
LucianoHuck,2021-03-04T20:45:06Z,"Chilique não resolve. O que resolve é “correr atrás” de novos fornecedores e vacinar toda a população. Brasil desperdiçou a chance de comprar vacinas. Agora, temos um SUS pronto para vacinar, mas não temos vacinas. E a rede hospitalar está evoluindo na direção do colapso. 😩",,,curious / curioso,Twitter for iPhone,pt,1367576858989121543
LucianoHuck,2021-03-04T02:59:15Z,1910 mortes. Segundo dia seguido com mais de uma morte por minuto no Brasil. Viramos exemplo de como NÃO se combater uma pandemia. Um governo que se destaca mundialmente pela incompetência.,,,curious / curioso,Twitter for iPhone,pt,1367308631599763456
LucianoHuck,2021-03-03T03:13:41Z,"Q tristeza. Q absurdo. Infelizmente atualmente o país também lidera na incompetência e na insensibilidade, que estão juntas e misturas no poder, @gugachacra. https://t.co/16NV3ZSn8y",,,curious / curioso,Twitter for iPhone,pt,1366949873715658752
LucianoHuck,2021-03-02T13:37:08Z,Os preços subiram demais. O custo do dia a dia dos alimentos esta pesando mais e mais no bolso das famílias. Isso estressa demais a enorme maioria. A gente conhece este bicho: é o dragão da inflação. Tem de domar a fera ou o país vai sair muito queimado. Não dá pra improvisar aí.,,,curious / curioso,Twitter for iPhone,pt,1366744381441638403
LucianoHuck,2021-03-01T12:03:21Z,"Para quem quiser acompanhar agora ao vivo; “Davos Lab” com eu, @ManuelaDavila, @MarinaSilva &amp; @SamuelEmilioSP e mediação de Kamila Camilo acesse o link https://t.co/JnJ5OMAVFm",,,curious / curioso,Twitter for iPhone,pt,1366358395393957895
LucianoHuck,2021-02-28T19:59:31Z,"Recomendo o video; “nacionalistas versus cosmopolitas no @canalmeio de @pedrodoria. De fácil compreensão, didático e necessário.  https://t.co/tZMAoXALjl",,,curious / curioso,Twitter for iPhone,pt,1366115838080745472
LucianoHuck,2021-02-28T19:53:43Z,"O desenvolvimento irregular e lento de Brasil se deve à privatização do Estado, isto é, à captura histórica dos governos nacionais por grupos de interesse, defende Armínio Fraga. @fraganomics é sinônimo de rigor analítico com responsabilidade fiscal e social e olhar cosmopolita. https://t.co/RkseAXOLyc",,,curious / curioso,Twitter for iPhone,pt,1366114378177798147
LucianoHuck,2021-02-28T19:42:21Z,Espero q o legado da pandemia seja a realização de q nenhum de nós está saudável enquanto tds não estiverem saudáveis.Nenhum de nós é rico enquanto tds não possamos ser prósperos e livres. E q isso dará início a uma mudança de mentalidade sobre uma sociedade melhor. @RebeccaReCap,,,curious / curioso,Twitter for iPhone,pt,1366111519021359109
LucianoHuck,2021-02-28T19:38:20Z,Estamos diante de uma profunda mudança em como precisamos lidar com nossa economia se queremos que nosso meio ambiente sobreviva e nossa sociedade prospere. @RebeccaReCap em conversa com @LucianoHuck no @Estadao,,,curious / curioso,Twitter for iPhone,pt,1366110506529005568
LucianoHuck,2021-02-28T19:36:51Z,Passei os primeiros 20 anos da minha carreira estudando mudanças em grandes corporações. Trabalhei p/ companhias como Kodak e Nokia. Os jovens nem conhecem mais essas empresas. Essas empresas viram o futuro e se recusaram a mudar. @RebeccaReCap em conversa com @LucianoHuck,,,curious / curioso,Twitter for iPhone,pt,1366110133919641605
LucianoHuck,2021-02-28T19:35:50Z,A pandemia colocou um rosto humano na igualdade. Os gestores tiveram de encarar a realidade e o fato que possuem responsabilidade pelas pessoas que trabalham para suas empresas. E espero que isso traga compaixão. @RebeccaReCap no @Estadao em conversa com @LucianoHuck,,,curious / curioso,Twitter for iPhone,pt,1366109877005910031
LucianoHuck,2021-02-28T19:35:14Z,Mercados livres precisam de política livre. Mas a única forma de o capitalismo se sustentar no longo prazo é em uma parceria firme com uma democracia genuína e inclusiva. @RebeccaReCap no @Estadao,,,curious / curioso,Twitter for iPhone,pt,1366109724270350344
LucianoHuck,2021-02-28T19:34:36Z,"Se você concentra poder e renda em um pequeno grupo, o crescimento econômico desacelera, as taxas de inovação desaceleram, a raiva cresce. O q faz uma sociedade + próspera e rica no longo prazo é trazer tds para dentro da sociedade, dar chances a todos. @RebeccaReCap no @Estadao",,,curious / curioso,Twitter for iPhone,pt,1366109565641703424
LucianoHuck,2021-02-28T19:29:41Z,Os governos têm o papel de estabelecer regras. Os negócios têm um papel de criar empregos e inovação. E a sociedade civil tem o papel de manter esses dois entes sempre em xeque. @RebeccaReCap no @Estadao,,,curious / curioso,Twitter for iPhone,pt,1366108331199389698
LucianoHuck,2021-02-28T19:28:56Z,"Precisamos de um equilíbrio entre o livre mercado, gov transparentes eleitos democraticamente e uma sociedade civil forte.Não se trata de “vms nos amar”ou “td será sempre lindo”. Mas de encarar as coisas como uma negociação, em q cada um tem os próprios interesses. @RebeccaReCap",,,curious / curioso,Twitter for iPhone,pt,1366108141205786628
LucianoHuck,2021-02-28T19:26:42Z,"O Brasil é um dos países + desiguais do planeta, c/ uma enorme concentração de renda e uma elite q até hoje sempre foi acusada de não se comprometer de fato c/ a construção de um país menos. Combater a pobreza não é bom apenas pra consciência, mas também p/ bolso. Hj no @Estadao",,,curious / curioso,Twitter for iPhone,pt,1366107578632200193
LucianoHuck,2021-02-28T19:24:34Z,"Vivemos uma necessária transformação de mentalidade das lideranças empresariais. De uma estrutura vertical onde um fala e outro apenas ouve, para algo mais aberto, maleável, democrático, mas não menos produtivo. Hj no @Estadao",,,curious / curioso,Twitter for iPhone,pt,1366107043074088960
LucianoHuck,2021-02-28T19:23:40Z,"A meu ver, as cabeças mais admiradas nas próximas décadas terão um perfil distinto das últimas. Serão aquelas que conseguirem repensar o capitalismo, endereçar a pobreza extrema e solucionar, além das palavras, as disfunções das sociedades a nível global. Hj no @Estadao",,,curious / curioso,Twitter for iPhone,pt,1366106816007053313
LucianoHuck,2021-02-28T17:10:24Z,"Daí a importância de ouvir a professora norte-americana. @RebeccaReCap comanda o curso mais disputado da Harvard Business School e carrega o título de maior prestígio desta universidade, honraria hoje limitada a só 25 acadêmicos. https://t.co/4kVCoT9DrP",LucianoHuck,,curious / curioso,Twitter for iPhone,pt,1366073276938747909
LucianoHuck,2021-02-28T17:10:23Z,"Minha geração tem a responsabilidade de humanizar o capitalismo dentro do marco da democracia, construindo um sistema com menos privilégios e mais oportunidades pra todos. https://t.co/ETQS4VUMvH",LucianoHuck,,curious / curioso,Twitter for iPhone,pt,1366073273864384514
LucianoHuck,2021-02-28T17:10:21Z,"O tema em debate neste domingo é polêmico e necessário: capitalismo. Nenhum outro sistema tirou tanta gente da pobreza criando tantas desigualdades, que ficaram ainda mais acentuadas nesta pandemia. https://t.co/b2xDEJKSvD",LucianoHuck,,curious / curioso,Twitter for iPhone,pt,1366073265064730624
LucianoHuck,2021-02-28T17:10:19Z,"Desde o começo da pandemia, publico no @Estadao conversas com pensadores, filósofos, professores e autores globais que podem iluminar o caminho do Brasil no pós-Covid. O hoje o papo é com Rebecca Henderson @RebeccaReCap https://t.co/Lfv3CBFphk",,,curious / curioso,Twitter for iPhone,pt,1366073255170301952
LucianoHuck,2021-02-27T21:50:46Z,"Gosto muito deste quadro do @caldeiraodohuck, o Visitando o Passado. E hj com minha amada amiga @xuxameneghel foi muito emocionante para todos nós. Entender o passado é o melhor jeito de construir um futuro melhor.",,,curious / curioso,Twitter for iPhone,pt,1365781446561058817
LucianoHuck,2021-02-26T22:00:00Z,Ontem foi dia do sogrão se vacinar! Que alegria! 😊🙌 https://t.co/aO4nF30N6p,,,curious / curioso,Twitter Media Studio,pt,1365421381798686727
